SKU;SEGUIMENTO;Categoria;TIPO;Fornecedor;Descrição / Aplicação;"Código Do 
Fornecedor";" CMV 
Unitário ";"Altura
(cm)";"Comprimento
(cm)";"Largura
(cm)";Peso
112107;AUTOMOTIVO;Bandeja;SIMPLES;SPARE;Bandeja Esquerda Com Pivô Grand Siena 2012 Em Diante;; R$ 69,17 ;;;;
112108;AUTOMOTIVO;Bandeja;SIMPLES;SPARE;Bandeja Direita Sem Pivô Uno Vivace 2010 Em Diante;;  ;;;;
112109;AUTOMOTIVO;Bandeja;SIMPLES;SPARE;Bandeja Esquerda Sem Pivô Uno Vivace 2010 Em Diante;; R$ 22,00 ;;;;
112113;AUTOMOTIVO;;SIMPLES;;;;;;;;
112114;AUTOMOTIVO;;SIMPLES;;;;;;;;
112115;AUTOMOTIVO;Bandeja;SIMPLES;SPARE;Bandeja Dianteira Sem Pivô Esquerda Toro  2018 À 2020;;  ;;;;
112116;AUTOMOTIVO;Bandeja;SIMPLES;SPARE;Bandeja Inferior Ambos Lados Renegade Sem Pivô 2015 A 2020;;  ;;;;
112117;AUTOMOTIVO;Bandeja;SIMPLES;SPARE;Bandeja Dianteira Direita Com Pivô Compass 4x4 2015 A 2020;;  ;;;;
112118;AUTOMOTIVO;Bandeja;SIMPLES;SPARE;Bandeja Dianteira Esquerda Com Pivô Toro 4x4 2016 A 2020;;  ;;;;
112120;AUTOMOTIVO;Bandeja;SIMPLES;SPARE;BANDEJA DIANTEIRA DIREITA SEM PIVÔ DUCATO 1994 A 2009;;;;;;
112121;AUTOMOTIVO;Bandeja;SIMPLES;SPARE;BANDEJA DIANTEIRA ESQUERDA SEM PIVÔ DUCATO 1994 A 2009;;;;;;
112124;AUTOMOTIVO;Bandeja;SIMPLES;SPARE;Bandeja Esquerda Inferior Esq Strada 2020 Á 2022 Com Pivô;; R$ -   ;;;;
112125;AUTOMOTIVO;Bandeja;SIMPLES;SPARE;Bandeja Dianteira Inferior Esq Strada 2020 Á 2022 Com Pivô;; R$ -   ;;;;
112126;AUTOMOTIVO;Bandeja;SIMPLES;SPARE;Bandeja Inferior Direita Com Pivô Idea Elx 2005 A 2016;;  ;;;;
112127;AUTOMOTIVO;Bandeja;SIMPLES;SPARE;Bandeja Inferior Esquerda Com Pivô Idea Elx 2005 A 2016;;  ;;;;
112132;AUTOMOTIVO;Bandeja;SIMPLES;SPARE;Bandeja Dianteira Direita Com Pivô Punto 2008 A 2017;;  ;;;;
112133;AUTOMOTIVO;Bandeja;SIMPLES;SPARE;Bandeja Dianteira Esquerda Com Pivô Linea 2008 A 2016;;  ;;;;
205051;AUTOMOTIVO;;SIMPLES;;;;;;;;
221142;AUTOMOTIVO;Cabo de Capô;SIMPLES;MundiFlex;Cabo De Capô Com Alavanca 1623mm Palio 2008 A 2012;; R$ 12,48 ;;;;
222010;AUTOMOTIVO;Bandeja;SIMPLES;SPARE;Braço Oscilante Direito Sem Bucha Apollo 1990 A 1992;; R$ 21,00 ;;;;
222011;AUTOMOTIVO;Bandeja;SIMPLES;SPARE;Braço Oscilante Esquerdo Sem Bucha Escort 1983 A 1996;;  ;;;;
222014;AUTOMOTIVO;Bandeja;SIMPLES;SPARE;Bandeja Superior Direita Com Pivô Ranger 1998 A 2011;; R$ 60,52 ;;;;
222015;AUTOMOTIVO;Bandeja;SIMPLES;SPARE;Bandeja Superior Esquerda Com Pivô Ranger 1998 A 2011;; R$ 60,52 ;;;;
222016;AUTOMOTIVO;Bandeja;SIMPLES;SPARE;BANDEJA SUPERIOR DIREITA COM PIVÔ RANGER 2012 A 2022;;;;;;
222017;AUTOMOTIVO;Bandeja;SIMPLES;SPARE;Bandeja Superior Esquerda Com Pivô  Ranger 2012 A 2022;; R$ -   ;;;;
222020;AUTOMOTIVO;Bandeja;SIMPLES;SPARE;Bandeja Inferior Direito Ka 1997 Á 1999 Sem Pivô;; R$ 52,85 ;;;;
222021;AUTOMOTIVO;Bandeja;SIMPLES;SPARE;Bandeja Inferior Esquerda Ka Sem Pivô 1996 Á 2007;;  ;;;;
222022;AUTOMOTIVO;Bandeja;SIMPLES;SPARE;Bandeja Inferior Direito Ka Com Pivô;;  ;;;;
222023;AUTOMOTIVO;Bandeja;SIMPLES;SPARE;Bandeja Inferior Esquerdo Ka Com Pivô;;  ;;;;
222028;AUTOMOTIVO;Bandeja;SIMPLES;SPARE;BANDEJA FIESTA 94/95 (importado), KA 00/07 - chapa simples, direção hidraúlica  D/E;;;;;;
222030;AUTOMOTIVO;Bandeja;SIMPLES;SPARE;Bandeja Inferior Chapa Simples Direito Fiesta Sem Pivô;;  ;;;;
222031;AUTOMOTIVO;Bandeja;SIMPLES;SPARE;Bandeja Inferior Direito Chapa Simples Courier Sem Pivô;; R$ 22,00 ;;;;
222032;AUTOMOTIVO;Bandeja;SIMPLES;SPARE;BANDEJA DIANTEIRA DIREITA COM PIVÔ COURIER 2000 A 2003;; R$ -   ;;;;
222033;AUTOMOTIVO;Bandeja;SIMPLES;SPARE;Bandeja Dianteira Esquerda Com Pivô Fiesta 2000 A 2003;; R$ -   ;;;;
222037;AUTOMOTIVO;Bandeja;SIMPLES;SPARE;Bandeja Inferior Ambos Os Lados Chapa. D Fiesta Street;;  ;;;;
222051;AUTOMOTIVO;Bandeja;SIMPLES;SPARE;Bandeja Inferior Esquerdo Fiesta Sem Pivô 2003 Á 2009;;  ;;;;
222052;AUTOMOTIVO;Bandeja;SIMPLES;SPARE;Bandeja Inferior Direito Ecosport Sem Pivô 2003 Á 2011;;  ;;;;
222053;AUTOMOTIVO;Bandeja;SIMPLES;SPARE;Bandeja Dianteira Direita Com Pivô Ecosport 2003 A 2011;; R$ 63,66 ;;;;
222054;AUTOMOTIVO;Bandeja;SIMPLES;SPARE;Bandeja Dianteira Esquerda Com Pivô Fiesta 2003 A 2009;;  ;;;;
222061;AUTOMOTIVO;Bandeja;SIMPLES;SPARE;Bandeja Inferior Esquerdo Ka Direção Hidráulica 08 Á 13;;  ;;;;
222062;AUTOMOTIVO;Bandeja;SIMPLES;SPARE;Bandeja Inferior Direito Ka Direção Hidráulica  08 Á 13;;  ;;;;
222063;AUTOMOTIVO;Bandeja;SIMPLES;SPARE;Bandeja Inferior Esquerdo Ka Direção Hidráulica Pivô 08 A 13;;  ;;;;
222064;AUTOMOTIVO;Bandeja;SIMPLES;SPARE;Bandeja Inferior Direito Ka Direção Hidráulica Pivô 08 Á 13;; R$ 50,16 ;;;;
222067;AUTOMOTIVO;Bandeja;SIMPLES;SPARE;BANDEJA INFERIOR DIREITA SEM PIVÔ FOCUS 1999 A 2008;; R$ -   ;;;;
222068;AUTOMOTIVO;Bandeja;SIMPLES;SPARE;BANDEJA INFERIOR ESQUERDA SEM PIVÔ FOCUS 1999 A 2008;; R$ -   ;;;;
222069;AUTOMOTIVO;Bandeja;SIMPLES;SPARE;BANDEJA INFERIOR DIREITA COM PIVÔ FOCUS 1999 A 2008;; R$ -   ;;;;
222070;AUTOMOTIVO;Pastilha Freio;SIMPLES;SPARE;BANDEJA INFERIOR ESQUERDA COM PIVÔ FOCUS 1999 A 2008;; R$ -   ;;;;
222072;AUTOMOTIVO;Bandeja;SIMPLES;SPARE;Bandeja Fiesta 2008 A 2014 Lado Direito Sem pivô;; R$ 22,00 ;;;;
222073;AUTOMOTIVO;Bandeja;SIMPLES;SPARE;Bandeja Fiesta 2008 A 2014 Lado Esquerdo Sem pivô;;  ;;;;
222074;AUTOMOTIVO;Bandeja;SIMPLES;SPARE;Bandeja Inferior Esquerdo Ecosport Sem Pivô;;  ;;;;
222075;AUTOMOTIVO;Bandeja;SIMPLES;SPARE;Bandeja Inferior Direito Ecosport Sem Pivô;;  ;;;;
222076;AUTOMOTIVO;Bandeja;SIMPLES;SPARE;Bandeja Inferior Direito Ecosport Com Pivô 2012 Em Diante;;  ;;;;
222077;AUTOMOTIVO;Bandeja;SIMPLES;SPARE;Bandeja Inferior Esquerdo Ecosport Com Pivô;;  ;;;;
222080;AUTOMOTIVO;;SIMPLES;;;;;;;;
222081;AUTOMOTIVO;;SIMPLES;;;;;;;;
222082;AUTOMOTIVO;Bandeja;SIMPLES;SPARE;BANDEJA DIANTEIRA DIREITA KA 2014 A 2020 COM PIVÔ;; R$ -   ;;;;
222083;AUTOMOTIVO;Bandeja;SIMPLES;SPARE;Bandeja Dianteira Esquerda New Fiesta 2011 A 2018 Com Pivô;; R$ -   ;;;;
222090;AUTOMOTIVO;;SIMPLES;;;;;;;;
222091;AUTOMOTIVO;;SIMPLES;;;;;;;;
222092;AUTOMOTIVO;;SIMPLES;;;;;;;;
222093;AUTOMOTIVO;;SIMPLES;;;;;;;;
222094;AUTOMOTIVO;Bandeja;SIMPLES;SPARE;Bandeja Traseira Direita Fusion 2006 A 2009;;  ;;;;
222096;AUTOMOTIVO;Bandeja;SIMPLES;SPARE;BANDEJA SUPERIOR DIREITA COM PIVÔ FUSION 2007 A 2012;;;;;;
222097;AUTOMOTIVO;Bandeja;SIMPLES;SPARE;BANDEJA SUPERIOR ESQUERDA COM PIVÔ FUSION 2007 A 2012;;;;;;
222098;AUTOMOTIVO;;SIMPLES;;;;;;;;
222099;AUTOMOTIVO;Bandeja;SIMPLES;SPARE;BANDEJA INFERIOR TRASEIRA AMBOS LADOS ESCORT ATÉ 1992;; R$ -   ;;;;
222102;AUTOMOTIVO;Bandeja;SIMPLES;SPARE;Bandeja Inferior Direita Com Pivô Focus 2009 A 2012;; R$ -   ;;;;
222103;AUTOMOTIVO;Bandeja;SIMPLES;SPARE;Bandeja Inferior Esquerda Com Pivô Focus 2009 A 2012;; R$ -   ;;;;
222104;AUTOMOTIVO;Bandeja;SIMPLES;SPARE;Bandeja Fiesta 2008 A 2014 Lado Direito Com pivô;; R$ 63,66 ;;;;
222105;AUTOMOTIVO;Bandeja;SIMPLES;SPARE;Bandeja Fiesta 2008 A 2014 Lado Esquerdo Com pivô;;  ;;;;
222108;AUTOMOTIVO;Bandeja;SIMPLES;SPARE;Braço Da Suspensão Inferior Fusion 2006 A 2012;; R$ -   ;;;;
222109;AUTOMOTIVO;Bandeja;SIMPLES;SPARE;Braço Curvo Direito Dianteiro Com Pivô Fusion 2007 A 2012;; R$ -   ;;;;
222110;AUTOMOTIVO;Bandeja;SIMPLES;SPARE;BRAÇO CURVO TRASEIRO BUMERANGUE FUSION 2006 A 2012;; R$ -   ;;;;
222111;AUTOMOTIVO;Bandeja;SIMPLES;SPARE;BRAÇO CURVO TRASEIRO BUMERANGUE FUSION 2006 A 2012;; R$ -   ;;;;
222203;AUTOMOTIVO;Cabo de Freio;SIMPLES;MundiFlex;Cabo De Freio Dianteiro Journey 2009 A 2016;; R$ 40,22 ;;;;
222308;AUTOMOTIVO;Bandeja;SIMPLES;SPARE;Bandeja Inferior Direita Com Pivô Edge 2008 A 2015;;  ;;;;
222309;AUTOMOTIVO;Bandeja;SIMPLES;SPARE;Bandeja Inferior Esquerda Com Pivô Edge 2008 A 2015;;  ;;;;
222310;AUTOMOTIVO;Pastilha Freio;SIMPLES;SPARE;BANDEJA INFERIOR ESQUERDA SEM PIVÔ FOCUS 2009 A 2012;; R$ -   ;;;;
222311;AUTOMOTIVO;Bandeja;SIMPLES;SPARE;BANDEJA INFERIOR DIREITA SEM PIVÔ FOCUS 2009 A 2012;; R$ -   ;;;;
222312;AUTOMOTIVO;Bandeja;SIMPLES;SPARE;BANDEJA INFERIOR DIREITA COM PIVÔ FOCUS 2013 A 2018;; R$ -   ;;;;
222313;AUTOMOTIVO;Pastilha Freio;SIMPLES;SPARE;BANDEJA INFERIOR ESQUERDA COM PIVÔ FOCUS 2013 A 2018;; R$ -   ;;;;
222314;AUTOMOTIVO;Bandeja;SIMPLES;SPARE;BANDEJA INFERIOR DIREITA SEM PIVÔ FOCUS 2013 A 2018;; R$ -   ;;;;
222315;AUTOMOTIVO;Pastilha Freio;SIMPLES;SPARE;BANDEJA INFERIOR ESQUERDA SEM PIVÔ FOCUS 2013 A 2018;; R$ -   ;;;;
225051;AUTOMOTIVO;Cabo Câmbio;SIMPLES;Importação;Cabo De Marcha Hyundai Hr 2005 A 2012;; R$ 85,00 ;;;;
225052;AUTOMOTIVO;Cabo Câmbio;SIMPLES;Importação;Cabo De Marcha Engate E Seleção Hyundai Hr 2013 Em Diante;;  ;;;;
226009;AUTOMOTIVO;Cabo Embreagem;SIMPLES;Importação;Cabo De Embreagem Sandero 2004 Em Diante 1.6 16v;; R$ -   ;;;;
226102;AUTOMOTIVO;Cabo de Acelerador;SIMPLES;Importação;Cabo De Acelerador Clio I I Motor 1.0 1.6 16v;; R$ -   ;;;;
226103;AUTOMOTIVO;Cabo de Acelerador;SIMPLES;Importação;Cabo De Acelerador Scenic 1996 Em Diante 1.6 2.0;; R$ -   ;;;;
226106;AUTOMOTIVO;Cabo de Acelerador;SIMPLES;Importação;Cabo De Acelerador Clio I I 1999 Em Diante 1.0 8v;; R$ -   ;;;;
227200;AUTOMOTIVO;Cabo Embreagem;SIMPLES;Importação;Cabo De Embreagem 206 1.0 16v Chassi .../9456 - Reg. Manual;; R$ 15,00 ;;;;
227201;AUTOMOTIVO;Cabo Embreagem;SIMPLES;Importação;Cabo Embreagem (regulagem Manual) Peugeot 206 1999 Em Diante;; R$ 15,00 ;;;;
227203;AUTOMOTIVO;Cabo Embreagem;SIMPLES;Importação;Cabo De Embreagem Peugeot 206 Até 03 1.1 1.3 1.6 Reg Manual;; R$ 15,00 ;;;;
227205;AUTOMOTIVO;Cabo Embreagem;SIMPLES;Importação;Cabo De Embreagem 206 1.0 16v D4d 1060mm Regulagem Manual;; R$ 15,00 ;;;;
227206;AUTOMOTIVO;Cabo Embreagem;SIMPLES;Importação;Cabo De Embreagem Peugeot 206 1.1 / 1.3 / 1.6 Chassi 9683/..;; R$ 15,00 ;;;;
229012;AUTOMOTIVO;Cabo de Velocímetro;SIMPLES;Importação;Cabo De Velocímetro Mitsubishi L200 Sport 2003 Em Diante;; R$ 3,00 ;;;;
229051;AUTOMOTIVO;Cabo de Acelerador;SIMPLES;Importação;Cabo De Acelerador Mitsubishi L200 Sport 2003 Em Diante;; R$ 15,00 ;;;;
302011;AUTOMOTIVO;Bandeja;SIMPLES;SPARE;Braço Da Suspensão Esquerdo Corsa Classic Sem Pivô;;  ;;;;
330074;AUTOMOTIVO;AMORTECEDOR SUSPENSÃO;SIMPLES;SPARE;PAR AMORTECEDOR DIANTEIRO FIESTA 1996 A 2001;;;;;;
330100;AUTOMOTIVO;;SIMPLES;;;;;;;;
330101;AUTOMOTIVO;;SIMPLES;;;;;;;;
330112;AUTOMOTIVO;Bandeja;SIMPLES;SPARE;Par Bandeja Inferior Traseira Escort Até 1992;; R$ -   ;;;;
330178;AUTOMOTIVO;;SIMPLES;;;;;;;;
330179;AUTOMOTIVO;;SIMPLES;;;;;;;;
330214;AUTOMOTIVO;AMORTECEDOR SUSPENSÃO;SIMPLES;SPARE;Par Amortecedor  Dianteiro Kangoo 1999 A 2012;; R$ -   ;;;;
330233;AUTOMOTIVO;AMORTECEDOR SUSPENSÃO;SIMPLES;SPARE;Par Amortecedor  Dianteiro Megane Grand Tour 2006 A 2010;; R$ -   ;;;;
330254;AUTOMOTIVO;;SIMPLES;;;; R$ -   ;;;;
330314;AUTOMOTIVO;AMORTECEDOR SUSPENSÃO;SIMPLES;SPARE;Par Amortecedor Dianteiro Sandero Logan;;;;;;
330351;AUTOMOTIVO;;SIMPLES;;;; R$ -   ;;;;
331050;AUTOMOTIVO;;SIMPLES;;;; R$ -   ;;;;
331051;AUTOMOTIVO;;SIMPLES;;;; R$ -   ;;;;
332000;AUTOMOTIVO;Bandeja;SIMPLES;SPARE;Bandeja Inferior Direita Sem Pivô Chevy 500 1984 A 1995;; R$ -   ;;;;
332001;AUTOMOTIVO;Bandeja;SIMPLES;SPARE;Bandeja Inferior Esquerda Sem Pivô Marajó 1973 A 1993;; R$ -   ;;;;
332002;AUTOMOTIVO;Bandeja;SIMPLES;SPARE;Bandeja Superior Direito Sem Pivô Chevy 500 1984 À 1995;; R$ 29,06 ;;;;
332003;AUTOMOTIVO;Bandeja;SIMPLES;SPARE;Bandeja Superior Esquerda Chevrolet Chevette;; R$ 22,00 ;;;;
332005;AUTOMOTIVO;;SIMPLES;;;;;;;;
332006;AUTOMOTIVO;;SIMPLES;;;;;;;;
332007;AUTOMOTIVO;Bandeja;SIMPLES;SPARE;Bandeja Direita Inferior Sem Pivô Kadett 1989 A 1998;;  ;;;;
332008;AUTOMOTIVO;Bandeja;SIMPLES;SPARE;Bandeja Esquerda Inferior Sem Pivô Kadett 1989 A 1998;;  ;;;;
332010;AUTOMOTIVO;Bandeja;SIMPLES;SPARE;Braço Da Suspensão Direito Corsa Wagon Sem Pivô 1995 A 1997;;  ;;;;
332011;AUTOMOTIVO;Bandeja;SIMPLES;SPARE;Braço Suspensão Esquerdo Corsa Wagon Sem Pivô 1995 A 1997;;  ;;;;
332014;AUTOMOTIVO;Bandeja;SIMPLES;SPARE;Braço Da Suspensão  Corsa Classic Sem Pivô 98 A 2016;;  ;;;;
332015;AUTOMOTIVO;Bandeja;SIMPLES;SPARE;Braço Da Suspensão Esquerdo Celta Sem Pivô 2000 A 2015;;  ;;;;
332016;AUTOMOTIVO;Bandeja;SIMPLES;SPARE;Braço Da Bandeja Direito Corsa Wagon Com Pivô 1995 A 1998;;  ;;;;
332017;AUTOMOTIVO;Bandeja;SIMPLES;SPARE;Braço Suspensão Esquerdo Corsa Pick Up Com Pivô 1994 A 1998;;  ;;;;
332022;AUTOMOTIVO;Bandeja;SIMPLES;SPARE;Bandeja Dianteira Direita Monza 1991 A 1996 Com Pivô;; R$ -   ;;;;
332023;AUTOMOTIVO;Bandeja;SIMPLES;SPARE;Bandeja Dianteira Esquerda Monza 1991 A 1996 Com Pivô;; R$ -   ;;;;
332024;AUTOMOTIVO;Bandeja;SIMPLES;SPARE;Bandeja Dianteira Ambos Lados Monza 1991 A 1996 Sem Pivô;; R$ -   ;;;;
332042;AUTOMOTIVO;Bandeja;SIMPLES;SPARE;Morceguinho Lado Direito Corsa 1994 A 1998;;  ;;;;
332043;AUTOMOTIVO;Bandeja;SIMPLES;SPARE;Morceguinho Lado Esquerdo Corsa 1994 A 1998;;  ;;;;
332052;AUTOMOTIVO;Bandeja;SIMPLES;SPARE;Morceguinho Dianteiro Classic Lado Direito 2004 A 2015;; R$ 13,75 ;;;;
332053;AUTOMOTIVO;Bandeja;SIMPLES;SPARE;Morceguinho Dianteiro Classic Lado Esquerdo 2004 A 2015;; R$ 15,00 ;;;;
332056;AUTOMOTIVO;Bandeja;SIMPLES;SPARE;Morceguinho Dianteira Direita Agile 2010 A 2014;; R$ 15,75 ;;;;
332057;AUTOMOTIVO;Bandeja;SIMPLES;SPARE;Morceguinho Dianteiro Esquerdo Montana 2011 A 2016;;  ;;;;
332065;AUTOMOTIVO;Bandeja;SIMPLES;SPARE;Bandeja Inferior Esquerda Sem Pivô Montana 2003 A 2010;;  ;;;;
332066;AUTOMOTIVO;Bandeja;SIMPLES;SPARE;Bandeja Infeiror Direita Sem Pivô Meriva 2003 A 2012;;  ;;;;
332067;AUTOMOTIVO;Bandeja;SIMPLES;SPARE;Bandeja Inferior Esquerda Com Pivô Montana 2003 A 2010;;  ;;;;
332068;AUTOMOTIVO;Bandeja;SIMPLES;SPARE;Bandeja Inferior Direita Com Pivô Meriva 2003 A 2012;; R$ 112,85 ;;;;
332074;AUTOMOTIVO;Bandeja;SIMPLES;SPARE;Bandeja Inferior Direita Sem Pivô Astra 1995 1996;; R$ -   ;;;;
332075;AUTOMOTIVO;Bandeja;SIMPLES;SPARE;Bandeja Inferior Direita Sem Pivô Astra 1995 1996;; R$ -   ;;;;
332076;AUTOMOTIVO;Bandeja;SIMPLES;SPARE;Bandeja Inferior Direita Com Pivô Astra 1995 1996;; R$ -   ;;;;
332077;AUTOMOTIVO;Bandeja;SIMPLES;SPARE;BANDEJA INFERIOR ESQUERDA COM PIVÔ ASTRA 1995 1996;; R$ -   ;;;;
332080;AUTOMOTIVO;Bandeja;SIMPLES;SPARE;Bandeja Dianteira Vectra Sem Pivô 1997 Á 2011;;  ;;;;
332081;AUTOMOTIVO;Bandeja;SIMPLES;SPARE;Bandeja Inferior Direita Com Pivô Vectra 1997 A 2005;;  ;;;;
332082;AUTOMOTIVO;Bandeja;SIMPLES;SPARE;Bandeja Inferior Esquerda Com Pivô Zafira 2001 A 2012;;  ;;;;
332090;AUTOMOTIVO;Bandeja;SIMPLES;SPARE;Bandeja Inferior Direito Cobalt 2013 Em Diante Sem Pivô;;  ;;;;
332091;AUTOMOTIVO;Bandeja;SIMPLES;SPARE;Bandeja Inferior Esquerdo Cobalt 2013 Em Diante Sem Pivô;;  ;;;;
332092;AUTOMOTIVO;Bandeja;SIMPLES;SPARE;Bandeja Direita Com Pivô Cobalt 2013 Em Diante;; R$ 69,13 ;;;;
332093;AUTOMOTIVO;Bandeja;SIMPLES;SPARE;Bandeja Esquerda Com Pivô Cobalt 2013 Em Diante;;  ;;;;
332100;AUTOMOTIVO;;SIMPLES;;;; R$ -   ;;;;
332101;AUTOMOTIVO;;SIMPLES;;;; R$ -   ;;;;
332102;AUTOMOTIVO;Bandeja;SIMPLES;SPARE;BANDEJA DIANTEIRA SUPERIOR ESQUERDA ÔMEGA/SUPREMA;; R$ -   ;;;;
332103;AUTOMOTIVO;Bandeja;SIMPLES;SPARE;BANDEJA DIANTEIRA SUPERIOR DIREITA ÔMEGA/SUPREMA NÃO EXPORTAR/SEM ESTOQUE;; R$ -   ;;;;
332108;AUTOMOTIVO;Bandeja;SIMPLES;SPARE;BANDEJA BLAZER, S10 4x2, 4x4 95/12 - Inferior LD;;;;;;
332109;AUTOMOTIVO;Bandeja;SIMPLES;SPARE;BANDEJA BLAZER, S10 4x2, 4x4 95/12 - Inferior LE;;;;;;
332110;AUTOMOTIVO;Bandeja;SIMPLES;SPARE;Bandeja Superior Direito S10 4x2 E 4x4 1995 Á 2011;; R$ 21,00 ;;;;
332111;AUTOMOTIVO;Bandeja;SIMPLES;SPARE;Bandeja Superior Esquerdo S10 4x2 E 4x4 1995 Á 2011;;  ;;;;
332112;AUTOMOTIVO;Bandeja;SIMPLES;SPARE;Bandeja Inferior Direita Com Pivô Chevy 500  1984 A 1995;; R$ -   ;;;;
332113;AUTOMOTIVO;Bandeja;SIMPLES;SPARE;Bandeja Inferior Esquerda Com Pivô Chevette 1973 A 1993;; R$ -   ;;;;
332114;AUTOMOTIVO;Bandeja;SIMPLES;SPARE;Bandeja Dianteira Direita Chevette 1973 A 1993 Com Pivô;; R$ -   ;;;;
332115;AUTOMOTIVO;Bandeja;SIMPLES;SPARE;Bandeja Dianteira Esquerda Chevette 1973 A 1993 Com Pivô;; R$ -   ;;;;
332116;AUTOMOTIVO;Bandeja;SIMPLES;SPARE;Bandeja Dianteira Inferior Direita Com Pivô Ipanema 89 À 98;;  ;;;;
332117;AUTOMOTIVO;Bandeja;SIMPLES;SPARE;Bandeja Dianteira Inferior Esquerda Com Pivô Daewoo 97 À 02;; R$ 21,00 ;;;;
332118;AUTOMOTIVO;Bandeja;SIMPLES;SPARE;BANDEJA INFERIOR DIREITA COM PIVÔ CRUZE 2017 A 2021;; R$ -   ;;;;
332119;AUTOMOTIVO;Bandeja;SIMPLES;SPARE;BANDEJA INFERIOR ESQUERDA COM PIVÔ CRUZE 2017 A 2021;; R$ -   ;;;;
332120;AUTOMOTIVO;Bandeja;SIMPLES;SPARE;BANDEJA INFERIOR CRUZE 16/20 - LADO DIREITO;; R$ -   ;;;;
332121;AUTOMOTIVO;Bandeja;SIMPLES;SPARE;Bandeja Dianteira Esquerda Com Pivô Cruze 2011 A 2016;; R$ -   ;;;;
332125;AUTOMOTIVO;;SIMPLES;;;; R$ -   ;;;;
332126;AUTOMOTIVO;Bandeja;SIMPLES;SPARE;Bandeja Inferior Esquerda Com Pivô S10 4x4 1996 A 2000;; R$ 75,82 ;;;;
332136;AUTOMOTIVO;Bandeja;SIMPLES;SPARE;Bandeja Inferior Opala 1980 Até 1992 Lado Direito;; R$ -   ;;;;
332137;AUTOMOTIVO;Bandeja;SIMPLES;SPARE;Bandeja Inferior Opala 1980 Até 1992 Lado Esquerdo;; R$ -   ;;;;
332138;AUTOMOTIVO;Bandeja;SIMPLES;SPARE;BANDEJA INFERIOR DIREITO OPALA 69/79 CARAVAN 75/79 SEM PIVÔ;;;;;;
332139;AUTOMOTIVO;Pastilha Freio;SIMPLES;SPARE;BANDEJA INFERIOR ESQUERDA OPALA 69/79 CARAVAN 75/79 SEM PIVÔ;; R$ -   ;;;;
332140;AUTOMOTIVO;Bandeja;SIMPLES;SPARE;BANDEJA INFERIOR DIREITA COM PIVÔ CARAVAN 1980 A 1992;; R$ -   ;;;;
332141;AUTOMOTIVO;Pastilha Freio;SIMPLES;SPARE;BANDEJA INFERIOR ESQUERDO COM PIVÔ CARAVAN 1980 A 1992;; R$ -   ;;;;
332142;AUTOMOTIVO;;SIMPLES;;;;;;;;
332143;AUTOMOTIVO;;SIMPLES;;;;;;;;
332144;AUTOMOTIVO;Bandeja;SIMPLES;SPARE;Bandeja Ambos Lados Tracker 1.4 Lt Ltz 2017 A 2020;;  ;;;;
332145;AUTOMOTIVO;Bandeja;SIMPLES;SPARE;Bandeja Esquerda Com Pivô Tracker 1.8 2014 A 2016;;  ;;;;
332146;AUTOMOTIVO;Bandeja;SIMPLES;SPARE;Bandeja Direita Com Pivô Tracker 1.4 Turbo 2017 A 2020;;  ;;;;
332147;AUTOMOTIVO;Bandeja;SIMPLES;SPARE;Bandeja Superior Direita Opala 1969 A 1992;; R$ 23,50 ;;;;
332148;AUTOMOTIVO;Bandeja;SIMPLES;SPARE;Bandeja Superior Esquerda Caravan 1975 A 1992;; R$ 23,50 ;;;;
332149;AUTOMOTIVO;Bandeja;SIMPLES;SPARE;Bandeja Superior Direita Sem Pivô Silverado 1997 A 2002;; R$ -   ;;;;
332150;AUTOMOTIVO;Bandeja;SIMPLES;SPARE;Bandeja Superior Esquerda Sem Pivô D10 1993 A 1996;; R$ -   ;;;;
332151;AUTOMOTIVO;Bandeja;SIMPLES;SPARE;BANDEJA DIANTEIRA DIREITA S10 2012 A 2016 COM PIVÔ;; R$ -   ;;;;
332152;AUTOMOTIVO;Bandeja;SIMPLES;SPARE;BANDEJA DIANTEIRA ESQUERDA S10 2012 A 2016 COM PIVÔ;; R$ -   ;;;;
332153;AUTOMOTIVO;Bandeja;SIMPLES;SPARE;BANDEJA SUPERIOR DIREITA SEM PIVÔ TRAILBLAZER 2012 A 2020;; R$ -   ;;;;
332154;AUTOMOTIVO;Bandeja;SIMPLES;SPARE;BANDEJA SUPERIOR ESQUERDA SEM PIVÔ TRAILBLAZER 2012 A 2020;; R$ -   ;;;;
332155;AUTOMOTIVO;Bandeja;SIMPLES;SPARE;Bandeja Superior Direita Com Pivô Silverado 1997 A 2002;; R$ -   ;;;;
332156;AUTOMOTIVO;Bandeja;SIMPLES;SPARE;BANDEJA SUPERIOR ESQUERDA COM PIVÔ A10 1993 A 1996;; R$ -   ;;;;
332157;AUTOMOTIVO;Bandeja;SIMPLES;SPARE;Bandeja Inferior Direita Sem Pivô D20 1985 A 1992;; R$ -   ;;;;
332158;AUTOMOTIVO;Bandeja;SIMPLES;SPARE;Bandeja Inferior Esquerda Sem Pivô D20 1985 A 1992;; R$ -   ;;;;
332636;AUTOMOTIVO;;SIMPLES;;;;;;;;
442025;AUTOMOTIVO;Bandeja;SIMPLES;SPARE;Bandeja Dianteira Ambos Lados Sem Pivô Variant 1970 A 1977;;  ;;;;
442050;AUTOMOTIVO;Bandeja;SIMPLES;SPARE;Bandeja Dianteira Ambos Lados Parati 1993 A 2008;;  ;;;;
442055;AUTOMOTIVO;Bandeja;SIMPLES;SPARE;Bandeja Dianteira Ambos Lados Gol 1993 A 2014 Exceto G5;; R$ -   ;;;;
442056;AUTOMOTIVO;Bandeja;SIMPLES;SPARE;Bandeja Inferior Direita Sem Pivô Royale 1991 A 1996;; R$ 32,64 ;;;;
442057;AUTOMOTIVO;Bandeja;SIMPLES;SPARE;Bandeja Inferior Esquerdo Sem Pivô Audi 80 Ano 1981 A 1991;; R$ 32,64 ;;;;
442058;AUTOMOTIVO;Bandeja;SIMPLES;SPARE;Bandeja Inferior Direita Com Pivô Santana 1988 A 2006;; R$ -   ;;;;
442059;AUTOMOTIVO;Bandeja;SIMPLES;SPARE;Bandeja Inferior Esquerda Com Pivô Santana 1988 A 2006;; R$ -   ;;;;
442060;AUTOMOTIVO;Bandeja;SIMPLES;SPARE;Bandeja Inferior Ambos Os Lados Sem Pivô Santana 1988 A 2002;; R$ -   ;;;;
442061;AUTOMOTIVO;Bandeja;SIMPLES;SPARE;Bandeja Esquerda Sem Pivô Audi A3 1996 A 2006;; R$ 40,73 ;;;;
442066;AUTOMOTIVO;Bandeja;SIMPLES;SPARE;Bandeja Inca 1999 Á 2001;; R$ 40,73 ;;;;
442067;AUTOMOTIVO;Bandeja;SIMPLES;SPARE;Bandeja Ibiza 1995 Á 2003  Lado Esquerdo Com Pivô;;  ;;;;
442068;AUTOMOTIVO;Bandeja;SIMPLES;SPARE;Bandeja Direita Com Pivô Polo Classic 1996 A 2001;;  ;;;;
442070;AUTOMOTIVO;Bandeja;SIMPLES;SPARE;Bandeja Inferior Direita Sem Pivô Ranger 2012 A 2019;;  ;;;;
442071;AUTOMOTIVO;Bandeja;SIMPLES;SPARE;Bandeja Inferior Esquerda Sem Pivô Ranger 2012 A 2019;;  ;;;;
442080;AUTOMOTIVO;Bandeja;SIMPLES;SPARE;Bandeja Inferior Belina Scala 1984 A 1991;; R$ 46,86 ;;;;
442081;AUTOMOTIVO;Bandeja;SIMPLES;SPARE;Bandeja Superior Direito Sem Pivô Pampa 1984 À 1997;; R$ 46,86 ;;;;
442082;AUTOMOTIVO;Bandeja;SIMPLES;SPARE;Bandeja Superior Esquerdo Sem Pivô  Del Rey 1984 À 1991;;  ;;;;
442083;AUTOMOTIVO;Bandeja;SIMPLES;SPARE;Bandeja Inferior Ambos Lados Escort 1993 A 1996 Sem Pivô;;  ;;;;
442084;AUTOMOTIVO;Bandeja;SIMPLES;SPARE;Bandeja Inferior Direita Com Pivô Verona 1993 A 1996;; R$ 21,00 ;;;;
442085;AUTOMOTIVO;Bandeja;SIMPLES;SPARE;Bandeja Inferior Esquerda Com Pivô Logus 1993 A 1996;;  ;;;;
442086;AUTOMOTIVO;Bandeja;SIMPLES;SPARE;Suporte Da Bandeja Suspensão Direita Ka 1997 Á 2007;; R$ -   ;;;;
442090;AUTOMOTIVO;Bandeja;SIMPLES;SPARE;Bandeja Sem Pivô Lado Esquerdo Saveiro G6 2012 Em Diante;; R$ 39,90 ;;;;
442091;AUTOMOTIVO;Bandeja;SIMPLES;SPARE;Bandeja Sem Pivô Lado Direito Gol G6 2012 Em Diante;; R$ 34,90 ;;;;
442092;AUTOMOTIVO;Bandeja;SIMPLES;SPARE;Bandeja Ld Voyage G5 2008 Em Diante Com Direção Hidraulica;; R$ 50,40 ;;;;
442093;AUTOMOTIVO;Bandeja;SIMPLES;SPARE;Bandeja Le Voyage G5 2008 Em Diante Com Direção Hidraulica;; R$ 21,00 ;;;;
442095;AUTOMOTIVO;Bandeja;SIMPLES;SPARE;Bandeja Inferior Ambos Os Lados Crossfox  2005 Á 2013;; R$ 21,00 ;;;;
442096;AUTOMOTIVO;Bandeja;SIMPLES;SPARE;Bandeja Dianteira Direita Com Pivô Polo Gti 2006 A 2017;;  ;;;;
442097;AUTOMOTIVO;Bandeja;SIMPLES;SPARE;Bandeja Dianteira Esquerda Com Pivô Fox 2003 A 2014;;  ;;;;
442100;AUTOMOTIVO;Bandeja;SIMPLES;SPARE;BANDEJA INFERIOR DIREITA SEM PIVÔ AUDI A3 2013 A 2018;; R$ -   ;;;;
442101;AUTOMOTIVO;Pastilha Freio;SIMPLES;SPARE;BANDEJA INFERIOR ESQUERDA SEM PIVÔ AUDI A3 2013 A 2018;; R$ -   ;;;;
442104;AUTOMOTIVO;Bandeja;SIMPLES;SPARE;Bandeja Inferior Direito Sem Pivô Passat 2012 A 2015;;  ;;;;
442105;AUTOMOTIVO;Bandeja;SIMPLES;SPARE;Bandeja Inferior Esquerdo Sem Pivô Volkswagen Cc 2010 A 2017;;  ;;;;
442106;AUTOMOTIVO;Bandeja;SIMPLES;SPARE;Bandeja Inferior Direito Com Pivô Passat 2012 A 2015;; R$ 146,28 ;;;;
442107;AUTOMOTIVO;Bandeja;SIMPLES;SPARE;Bandeja Inferior Esquerda Com Pivô Tiguan 2010 A 2017;; R$ -   ;;;;
442108;AUTOMOTIVO;Bandeja;SIMPLES;SPARE;BANDEJA VW JETTA LADO DIREITO COM pivô;;;;;;
442109;AUTOMOTIVO;Bandeja;SIMPLES;SPARE;BANDEJA VW JETTA ESQUERDA COM pivô;;;;;;
442110;AUTOMOTIVO;Bandeja;SIMPLES;SPARE;BANDEJA DIANTEIRA DIREITA SEM pivô NEW BEETLE 1999 A 2002;; R$ -   ;;;;
442111;AUTOMOTIVO;Bandeja;SIMPLES;SPARE;BANDEJA DIANTEIRA ESQUERDA SEM pivô NEW BEETLE 1999 A 2002;; R$ -   ;;;;
442112;AUTOMOTIVO;Bandeja;SIMPLES;SPARE;Bandeja Up Dianteira direita 2014 Em Diante Sem Pivô;; R$ -   ;;;;
442113;AUTOMOTIVO;Bandeja;SIMPLES;SPARE;Bandeja Up Dianteira Esquerda 2014 Em Diante Sem Pivô;;  ;;;;
442114;AUTOMOTIVO;Pastilha Freio;SIMPLES;SPARE;BANDEJA INFERIOR ESQUERDA SEM PIVÔ UP 2014 A 2020;; R$ -   ;;;;
442118;AUTOMOTIVO;Bandeja;SIMPLES;SPARE;Bandeja Inferior Direita Com Pivô Amarok 2010 A 2020 2.0;;  ;;;;
442119;AUTOMOTIVO;Bandeja;SIMPLES;SPARE;Bandeja Inferior Esquerda Com Pivô Amarok 2010 A 2020 2.0;;  ;;;;
442120;AUTOMOTIVO;Bandeja;SIMPLES;SPARE;Bandeja Superior Direito Amarok 2010 Á 2020;;  ;;;;
442121;AUTOMOTIVO;Bandeja;SIMPLES;SPARE;Bandeja Superior Esquerda Amarok 2010 Á 2020;;  ;;;;
442122;AUTOMOTIVO;Bandeja;SIMPLES;SPARE;Bandeja Inferior Direita Jetta 2.0 2.5 2005 A 2010 Sem Pivô;;  ;;;;
442123;AUTOMOTIVO;Bandeja;SIMPLES;SPARE;Bandeja Inferior Esquerda Jetta 2.0 2.5 2005 A 2010 Sem Pivô;;  ;;;;
442125;AUTOMOTIVO;Bandeja;SIMPLES;SPARE;Bandeja Inferior Esquerda Jetta 2.0 2.5 2005 A 2010 Com Pivô;; R$ -   ;;;;
442126;AUTOMOTIVO;Bandeja;SIMPLES;SPARE;Bandeja Inferior Direita Com Pivô Golf Geração 7 2014 A 2018;; R$ -   ;;;;
442127;AUTOMOTIVO;Bandeja;SIMPLES;SPARE;Bandeja Esquerda Com Pivô Audi A3 2013 A 2018;; R$ -   ;;;;
442128;AUTOMOTIVO;Bandeja;SIMPLES;SPARE;Bandeja Up Dianteira direita 2014 Em Diante Com Pivô;; R$ -   ;;;;
442129;AUTOMOTIVO;Bandeja;SIMPLES;SPARE;Bandeja Up Dianteira Esquerda 2014 Em Diante Com Pivô;; R$ -   ;;;;
442144;AUTOMOTIVO;Bandeja;SIMPLES;SPARE;Bandeja Inferior Esquerda Sem Pivô Polo 2017 Em Diante;; R$ 22,00 ;;;;
442145;AUTOMOTIVO;Bandeja;SIMPLES;SPARE;Bandeja Inferior Direita Sem Pivô Polo 2017 Em Diante;;  ;;;;
442146;AUTOMOTIVO;Pastilha Freio;SIMPLES;SPARE;Suporte Bandeja Balança Direita Fox 2004 A 2014;; R$ -   ;;;;
442147;AUTOMOTIVO;Bandeja;SIMPLES;SPARE;Suporte Bandeja Balança Esquerda Spacefox 2011 A 2014;; R$ -   ;;;;
550111;AUTOMOTIVO;Cabo Embreagem;SIMPLES;MundiFlex;Tubo Flexível Kombi Todos Até 1996;; R$ 6,93 ;;;;
550230;AUTOMOTIVO;Bieleta;SIMPLES;HOLYMAN;BIELETA REFORÇADA DIANTEIRA AMBOS LADOS EXPLORER 1992 A 1994;; R$ -   ;;;;
550291;AUTOMOTIVO;Cabo Embreagem;SIMPLES;MundiFlex;Tubo Flexível Kombi T2 Motor A Água 2006 Em Diante;; R$ 7,91 ;;;;
551311;AUTOMOTIVO;Cabo de Freio;SIMPLES;MundiFlex;Cabo De Freio Parati 1993 A 1995 1.6 Álc Gas;; R$ -   ;;;;
552001;AUTOMOTIVO;Bandeja;SIMPLES;SPARE;Bandeja Lado Esquerdo Peugeot 206 Todos 1999 A 2010 C Pivô;; R$ 65,00 ;;;;
552002;AUTOMOTIVO;Bandeja;SIMPLES;SPARE;Bandeja Ld Peugeot 207 Exceto Escapade 2008 Em Diante C Pivô;; R$ 65,00 ;;;;
552004;AUTOMOTIVO;Bandeja;SIMPLES;SPARE;Bandeja Superior 106 Lado Direito Sem pivô 1992 Á 2001;; R$ -   ;;;;
552005;AUTOMOTIVO;Bandeja;SIMPLES;SPARE;Bandeja Superior 106 Lado Esquerdo Sem pivô 1992 Á 2001;; R$ -   ;;;;
552006;AUTOMOTIVO;Bandeja;SIMPLES;SPARE;Bandeja - AX 96/ - inferior - Direita;; R$ -   ;;;;
