SKU;SEGUIMENTO;Categoria;TIPO;Fornecedor;Descrição / Aplicação;"Código Do 
Fornecedor";" CMV 
Unitário ";"Altura
(cm)";"Comprimento
(cm)";"Largura
(cm)";Peso
PAR-5416;AUTOMOTIVO;Bieleta;KIT;HOLYMAN;Par Bieleta Dianteira Civic 2012 A 2016;; R$ -   ;;;;
PAR-5417;AUTOMOTIVO;Bieleta;KIT;HOLYMAN;Par Bieleta Dianteira Ambos Os Lados  Cr-v 2006 A 2011;; R$ 32,40 ;;;;
PAR-5425/26;AUTOMOTIVO;Bieleta;KIT;HOLYMAN;Par Bieleta Dianteira Hrv 2016 A 2021;;;;;;
PAR-5427/28;AUTOMOTIVO;Bieleta;KIT;HOLYMAN;Par Bieleta Dianteira Wr-v 2017 Em Diante;; R$ -   ;;;;
PAR-5433;AUTOMOTIVO;Bieleta;KIT;HOLYMAN;Par Bieleta Dianteira Civic G10 2017 Em Diante;; R$ -   ;;;;
PAR5501;AUTOMOTIVO;Bieleta;KIT;HOLYMAN;Par Bieleta Dianteira Corolla Fielder 2004 A 2008;; R$ 32,40 ;;;;
PAR-5502;AUTOMOTIVO;Bieleta;KIT;HOLYMAN;Par Bieleta Dianteira Hilux Sw4 4x4 1996 A 2004;; R$ -   ;;;;
PAR-55120;AUTOMOTIVO;Cabo de Freio;KIT;MundiFlex;Par Cabo De Freio Fusca 1.200 Todos Até 1981;; R$ 32,34 ;;;;
par-55123;AUTOMOTIVO;Pino de Freio;KIT;MultiKit;Par Cabo De Freio Brasília 1300 1500 1600;; R$ 30,00 ;;;;
PAR5520;AUTOMOTIVO;Bieleta;KIT;HOLYMAN;Par Bieleta Dianteira Yaris 2018 Em Diante;; R$ 32,40 ;;;;
par552002-5701;AUTOMOTIVO;Bandeja e Bieleta;KIT;SPARE / HOLYMAN;Par Bandeja E Bieleta Peugeot 206 Todos 1999 A 2010;; R$ 137,94 ;;;;
par552010/11;AUTOMOTIVO;Bandeja;KIT;SPARE;Par Bandeja Sem Pivô Citroen C3 2013 Em Diante;; R$ 118,76 ;;;;
PAR552030/31;AUTOMOTIVO;Bandeja;KIT;SPARE;Par Bandeja Inferior Xsara Picasso 2001 A 2011 Com Pivô;; R$ 119,26 ;;;;
PAR-552032/33;AUTOMOTIVO;Bandeja;KIT;SPARE;Par Bandeja Inferior Com Pivô Peugeot 208 2013 A 2022;; R$ -   ;;;;
PAR-552034/35;AUTOMOTIVO;Bandeja;KIT;SPARE;Par Bandeja Dianteira Citroen C5 2001 A 2007 2.0 3.0;; R$ -   ;;;;
PAR-55311;AUTOMOTIVO;Cabo limitador tampa traseira;KIT;MundiFlex;Par Cabo Limitador Da Tampa Traseira Saveiro G2;; R$ -   ;;;;
PAR-55351;AUTOMOTIVO;Cabo limitador tampa traseira;KIT;MundiFlex;Par Cabo Limitador Tampa Traseira Saveiro G5 2009 Em Diante;; R$ -   ;;;;
PAR-559130/40;AUTOMOTIVO;Bieleta;KIT;HOLYMAN;Par Bieleta Dianteira Reforçada L200 Triton 2007 A 2013;; R$ -   ;;;;
Par-5607;AUTOMOTIVO;Bieleta;KIT;HOLYMAN;Par Bieleta Dianteira Tucson Sportage;; R$ 34,56 ;;;;
PAR-5608;AUTOMOTIVO;Bieleta;KIT;HOLYMAN;Par Bieleta Traseira  Tucson Sportage;; R$ 35,00 ;;;;
PAR5613;AUTOMOTIVO;Bieleta;KIT;HOLYMAN;Par Bieleta Dianteira Tucson 2005 A 2017;; R$ 34,56 ;;;;
PAR5614;AUTOMOTIVO;Bieleta;KIT;HOLYMAN;Par Bieleta Dianteira Azera 2007 A 2011 Motor 3.3;; R$ 38,88 ;;;;
PAR5615;AUTOMOTIVO;Bieleta;KIT;HOLYMAN;Par Bieleta Traseira Sonata 2011 A 2014;; R$ 47,52 ;;;;
PAR5616;AUTOMOTIVO;Bieleta;KIT;HOLYMAN;Par Bieleta Dianteira Sportage 2011 A 2015;; R$ 36,18 ;;;;
PAR5619;AUTOMOTIVO;Bieleta;KIT;HOLYMAN;Par Bieleta Dianteira I30 2006 A 2010;; R$ 30,24 ;;;;
PAR5623;AUTOMOTIVO;Bieleta;KIT;HOLYMAN;Par Bieleta Traseira Sonata 2004 A 2009;; R$ 32,40 ;;;;
PAR-5625;AUTOMOTIVO;Bieleta;KIT;HOLYMAN;Par Braço Da Suspensão Traseira Sonata 2011 A 2015;; R$ -   ;;;;
PAR-5701;AUTOMOTIVO;Bieleta;KIT;HOLYMAN;Par Bieleta Dianteira Peugeot 2008 2016 A 2019;; R$ 30,24 ;;;;
Par-5705;AUTOMOTIVO;Bieleta;KIT;HOLYMAN;Par Bieleta Dianteira C4 Picasso 2009 A 2019;; R$ 30,24 ;;;;
Par-5711;AUTOMOTIVO;Bieleta;KIT;HOLYMAN;Par Bieleta Dianteira C3 Picasso 2012 Em Diante;; R$ 33,00 ;;;;
PAR-5716;AUTOMOTIVO;Bieleta;KIT;HOLYMAN;Par Bieleta Dianteira 206 1.0 16v Todos Ld Le;; R$ 32,40 ;;;;
Par-5717;AUTOMOTIVO;Bieleta;KIT;HOLYMAN;Par Bieleta Barra Peugeot 307 308 408 3008 C4 - C4  Picasso;; R$ 34,56 ;;;;
PAR-5921;AUTOMOTIVO;Bieleta;KIT;HOLYMAN;Par Bieleta Traseira Airtrek 2003 Á 2008;; R$ -   ;;;;
PAR-5924/25;AUTOMOTIVO;Bieleta;KIT;HOLYMAN;Par Bieleta Dianteira L200 Triton Sport 2016 A 2019;; R$ -   ;;;;
PAR6001;AUTOMOTIVO;Bieleta;KIT;HOLYMAN;Par Bieleta Dianteira Logan 2006 Em Diante;; R$ 17,28 ;;;;
PAR-6005;AUTOMOTIVO;Bieleta;KIT;HOLYMAN;Par Bieleta Dianteira Arrizo 6 2020 Em Diante;; R$ -   ;;;;
PAR-6009;AUTOMOTIVO;Bieleta;KIT;HOLYMAN;Par Bieleta Dianteira Eclipse Cross 2018 Em Diante;; R$ -   ;;;;
PAR-6012;AUTOMOTIVO;Bieleta;KIT;HOLYMAN;Par Bieleta Dianteira Captur 2017 Em Diante;; R$ -   ;;;;
PAR-6202/03;AUTOMOTIVO;Bieleta;KIT;HOLYMAN;Par Bieleta Dianteira X-trail 2004 A 2009;; R$ -   ;;;;
PAR-6208;AUTOMOTIVO;Bieleta;KIT;HOLYMAN;Par Bieleta Dianteira Grand Livina 2009 A 2017;; R$ -   ;;;;
PAR-6209;AUTOMOTIVO;Bieleta;KIT;HOLYMAN;Par Bieleta Traseira Frontier 2017 A 2022;; R$ -   ;;;;
par6210/11;AUTOMOTIVO;Bieleta;KIT;HOLYMAN;Par Bieleta Dianteira Nissan Altima 2013 A 2019;; R$ 68,00 ;;;;
PAR6312;AUTOMOTIVO;Bieleta;KIT;HOLYMAN;Par Bieleta Dianteira Towner Furgão 2011 Em Diante;; R$ 21,06 ;;;;
PAR-6316;AUTOMOTIVO;Bieleta;KIT;HOLYMAN;Par Bieleta Dianteira Hb20 2012 A 2020;; R$ -   ;;;;
Par-6401;AUTOMOTIVO;Bieleta;KIT;HOLYMAN;Par Bieleta Dianteira Peugeout Partner 1999 A 2014 10mm;; R$ 33,00 ;;;;
PAR-6408;AUTOMOTIVO;Bieleta;KIT;HOLYMAN;Par Bieleta  Dianteira Citroen C3 Aircross;; R$ 30,67 ;;;;
PAR-6615/16;AUTOMOTIVO;Pastilha Freio;KIT;HOLYMAN;Par Bieleta Dianteira Bmw 130i 2005 A 2009 E82 E 87;; R$ -   ;;;;
PAR-6617;AUTOMOTIVO;Bieleta;KIT;HOLYMAN;Par Bieleta Dianteira Bmw 320i 2012 A 2015;; R$ -   ;;;;
PAR662010/11;AUTOMOTIVO;Bandeja;KIT;SPARE;Par Bandeja Dianteira Inferior Sem Pivô Kwid 2017 Em Diante;;  ;;;;
PAR662012/13;AUTOMOTIVO;Bandeja;KIT;SPARE;Par Bandeja Inferior Com Pivô Kwid 2017 Em Diante;; R$ 112,84 ;;;;
par662028/29;AUTOMOTIVO;Bandeja;KIT;SPARE;Par Bandeja Sem Pivô New Megane 2007 Em Diante;; R$ 143,26 ;;;;
par662030/31;AUTOMOTIVO;Bandeja;KIT;SPARE;Par Bandeja Com Pivô New Megane 2007 Em Diante;; R$ 107,88 ;;;;
PAR662046/47;AUTOMOTIVO;BANDEJA;KIT;SPARE;Par Dianteira Bandeja Com Pivô Sandero 2014 A 2019;; R$ -   ;;;;
par662052/53;AUTOMOTIVO;Bandeja;KIT;SPARE;Par Bandeja Com Pivô Renault Logan 2004 Em Diante;; R$ 89,76 ;;;;
PAR-662068/69;AUTOMOTIVO;Bandeja;KIT;SPARE;Par Bandeja Dianteira Com Pivô Fluence 2011 À 2018;;  ;;;;
par-66516;AUTOMOTIVO;Cabo limitador tampa traseira;KIT;MundiFlex;Par Cabo Limitador Tampa Tras Strada Fase 4 2013 Em Diante;; R$ 24,74 ;;;;
PAR-6700;AUTOMOTIVO;Bieleta;KIT;HOLYMAN;Par Bieleta Dianteira Troller 1999 Até 2019;; R$ -   ;;;;
PAR-7300;AUTOMOTIVO;Bieleta;KIT;HOLYMAN;Par Bieleta Dianteira J6 2011 À 2017;; R$ 34,56 ;;;;
PAR772003/4;AUTOMOTIVO;Bandeja;KIT;SPARE;Par Bandeja Inferior Com Pivô Fit 2003 A 2018;;  ;;;;
PAR-772011/12;AUTOMOTIVO;Bandeja;KIT;SPARE;Par Bandeja Dianteira Fit 2015 A 2021 Com Pivô;; R$ -   ;;;;
par772025/26;AUTOMOTIVO;Bandeja;KIT;SPARE;Par Bandeja Inferior Sem Pivô Civic 2007 A 2011;;  ;;;;
par772027/28;AUTOMOTIVO;Bandeja;KIT;SPARE;Par Bandeja Inferior Com Pivô Civic 2007 A 2011;; R$ 114,77 ;;;;
par772031/2;AUTOMOTIVO;Bandeja;KIT;SPARE;Par Bandeja Inferior Corolla 2001 A 2019;;  ;;;;
PAR-772042/43;AUTOMOTIVO;BANDEJA;KIT;SPARE;Par Bandeja Dianteira Hilux Pick Up 2005 A 2015 Sem Pivô;; R$ -   ;;;;
par772052/53;AUTOMOTIVO;Bandeja;KIT;SPARE;Par Bandeja Inferior Sem Pivô Sportage 2006 A 2009;; R$ 44,00 ;;;;
par772054/55;AUTOMOTIVO;Bandeja;KIT;SPARE;Par Bandeja Inferior Sem Pivô I30 2008 A 2012;; R$ 44,00 ;;;;
par772054/55p;AUTOMOTIVO;BANDEJA;KIT;SPARE;Par Bandeja Inferior Com Pivô I30 2008 A 2012;; R$ -   ;;;;
PAR-772088/89;AUTOMOTIVO;Bandeja;KIT;SPARE;Par Bandeja Dianteira Sem Pivô Mondeo 1997 A 2000;; R$ -   ;;;;
Par772100/1;AUTOMOTIVO;Bandeja;KIT;SPARE;Par Bandeja March 2011 Em Diante Sem Pivô;;  ;;;;
par772102/3;AUTOMOTIVO;Bandeja;KIT;SPARE;Par Bandeja Com Pivô March 2011 Em Diante;;  ;;;;
par772102-p;AUTOMOTIVO;Pivô;KIT;SPARE;Par Pivô Nissan March 2011 Em Diante;;  ;;;;
PAR772104/05;AUTOMOTIVO;Bandeja;KIT;SPARE;Par Bandeja Inferior Direito Sem Pivô  Livina;;  ;;;;
PAR772106/07;AUTOMOTIVO;Bandeja;KIT;SPARE;Par Bandeja Inferior Com Pivô Nissan Tiida;; R$ 166,16 ;;;;
PAR77214445/1;AUTOMOTIVO;Bandeja;KIT;SPARE;Par De Bandejas Hb20 Hatch Automático;;  ;;;;
PAR772154/55;AUTOMOTIVO;Bandeja;KIT;SPARE;Par Bandeja Inferior Sem Pivô L300 1994 Em Diante;;  ;;;;
PAR772156/57;AUTOMOTIVO;Bandeja;KIT;SPARE;Par Bandeja Dianteira Hr 2005 Em Diante;;  ;;;;
PAR-772161/62;AUTOMOTIVO;BANDEJA;KIT;SPARE;Par Bandeja Dianteira Sem Pivô Grand Santa Fé 2014 2015;; R$ -   ;;;;
PAR772172/73;AUTOMOTIVO;Bandeja;KIT;SPARE;Par Bandeja Inferior Com Pivô Kia Soul 2009 A 2014;; R$ 44,00 ;;;;
PAR-772182/83;AUTOMOTIVO;Bandeja;KIT;SPARE;Par Rolamento Roda Dianteira Subaru Impreza 1.8 1994 A 2007;; R$ -   ;;;;
PAR-772194;AUTOMOTIVO;Bandeja;KIT;SPARE;Par Bandeja Superior Besta 1998 A 2003 Ambos Os Lados;; R$ -   ;;;;
PAR772214/15;AUTOMOTIVO;Bandeja;KIT;SPARE;Par Bandeja Inferior Pajero Tr4 Sem Pivô 2000 Á 2014;;  ;;;;
PAR-772230/31;AUTOMOTIVO;Bandeja;KIT;SPARE;Par Bandeja Inferior Com Pivô Kicks 2016 A 2020;; R$ -   ;;;;
PAR772248/49;AUTOMOTIVO;Bandeja;KIT;SPARE;Par Bandeja Inferior Sem Pivô Rav4;;  ;;;;
PAR-7800;AUTOMOTIVO;Bieleta;KIT;HOLYMAN;Par Bieleta Traseira Compass 4x4 2015 Em Diante;; R$ 38,88 ;;;;
PAR-7801;AUTOMOTIVO;Bieleta;KIT;HOLYMAN;Par Bieleta Dianteira Compass 4x2 4x4 2015 Em Diante;; R$ 38,88 ;;;;
Par-7802;AUTOMOTIVO;Bieleta;KIT;HOLYMAN;Par Bieleta Dianteira Compass 2007 A 2015;; R$ 38,88 ;;;;
PAR-8000;AUTOMOTIVO;Bieleta;KIT;HOLYMAN;Par Bieleta Dianteira Land Rover Evoque 2011 Em Diante;; R$ 47,52 ;;;;
PAR-8001;AUTOMOTIVO;Bieleta;KIT;HOLYMAN;Par Bieleta Traseira Nissan Frontier 2003 A 2007;; R$ 47,52 ;;;;
PAR-8003;AUTOMOTIVO;Bieleta;KIT;HOLYMAN;Par Bieleta Traseira Frontier X-terra 2003 Até 2008;; R$ -   ;;;;
PAR-8004;AUTOMOTIVO;Bieleta;KIT;HOLYMAN;Par Bieleta Dianteira Discovery 3 2004 Até 2009;; R$ -   ;;;;
PAR-8106;AUTOMOTIVO;Bieleta;KIT;HOLYMAN;Par Bieleta Traseira Chery Cielo 2008 A 2013;; R$ 32,40 ;;;;
PAR-8501;AUTOMOTIVO;Bieleta;KIT;HOLYMAN;Par Bieleta Dianteira Cooper S R56 2006 A 2014;; R$ -   ;;;;
PAR8502;AUTOMOTIVO;Bieleta;KIT;HOLYMAN;Par Bieleta Traseira Mini Cooper Hatch 2001 Diante;; R$ 52,92 ;;;;
PAR8503;AUTOMOTIVO;Bieleta;KIT;HOLYMAN;Par Bieleta Dianteira Mini Cooper R50 R53 2001 A 2006;; R$ 58,32 ;;;;
Par-8650;AUTOMOTIVO;Terminal Cabo Câmbio;KIT;Importação;Terminal De Cabo De Engate Gol;; R$ -   ;;;;
PAR-882002/03;AUTOMOTIVO;Bandeja;KIT;SPARE;Par Bandeja Dianteira Com Pivô J3 2011 À 2015;; R$ 233,70 ;;;;
PAR993001;AUTOMOTIVO;Bandeja;KIT;SPARE;Par Braço Bandeja Balança Com Pivô Spark 2004 A 2015;;  ;;;;
Par-FD001;AUTOMOTIVO;Rolamento Roda;KIT;Importação;2 Kit's Rolamento Roda Traseira Escort 94 Fiesta 95 Ka 97 ;; R$ 60,00 ;;;;
PAR-FTK/PDA151;AUTOMOTIVO;Amortecedor Porta Mala;KIT;Pandão;Par Amortecedor Mola A Gás Porta Malas Agile 2009 A 2013;; R$ -   ;;;;
PAR-FTK/PDA152;AUTOMOTIVO;Amortecedor Porta Mala;KIT;Pandão;Par Amortecedor Mola A Gás Porta Malas Onix 2013 A 2019;; R$ -   ;;;;
PAR-FTK/PDA155;AUTOMOTIVO;Amortecedor Porta Mala;KIT;PANDÃO;Par Amortecedor Mola A Gás Porta Malas Fox 2003 A 2010;;;;;;
FTK/PDA155;AUTOMOTIVO;Amortecedor Porta Mala;SIMPLES;PANDÃO;Amortecedor Mola A Gás Porta Malas Fox 2003 A 2010;;;;;;
PAR-FTK/PDA162;AUTOMOTIVO;Amortecedor Porta Mala;KIT;Pandão;Par Amortecedor Mola A Gás Porta Malas Focus Hatch 2009 A 13;; R$ -   ;;;;
PAR-FTK/PDA163;AUTOMOTIVO;Amortecedor Porta Mala;KIT;Pandão;Par Amortecedor Mola A Gás Porta Malas Zafira 2001 Em Diante;; R$ -   ;;;;
PAR-FTK/PDA164;AUTOMOTIVO;Pastilha Freio;KIT;Pandão;Par Amortecedor Mola A Gás Porta Malas Spacefox 2006 A 2012;; R$ -   ;;;;
PAR-FTK00122;AUTOMOTIVO;Pivô;KIT;SPARE;Par Pivô Inferior Bandeja Ambos Lados Stilo 2001 A 2012;;;;;;
PAR-FTK00131/32;AUTOMOTIVO;Pivô;KIT;SPARE;Par Pivô Inferior Argo Drive 1.0 1.3 Gsr 2018 A 2021;;;;;;
PAR-FTK00212;AUTOMOTIVO;Rolamento roda;KIT;IRB;Par Pivô Inferior Ranger 2013 A 2017;; R$ -   ;;;;
PAR-FTK00226/27;AUTOMOTIVO;Pivô;KIT;SPARE;Par Pivô Inferior Focus 2014 Em Diante;; R$ -   ;;;;
PARFTK00311;AUTOMOTIVO;Bandeja;KIT;SPARE;Par Pivô Bandeja Cobalt 2011 Em Diante;; R$ 24,00 ;;;;
PAR-FTK00313;AUTOMOTIVO;Bucha Barra estabilizadora;KIT;GUARU BORRACHAS;Par Bucha Da Suspensão Dianteira Escort 1993 A Janeiro 1995;; R$ -   ;;;;
PARFTK00605;AUTOMOTIVO;pivô;KIT;SPARE;Par Pivô Da Bandeja Dianteira Duster 2011 A 2019;; R$ 24,00 ;;;;
PARFTK00606;AUTOMOTIVO;pivô;KIT;SPARE;Par Pivô Bandeja Dianteira  Fluence 2011 Em Diante;; R$ 24,00 ;;;;
PAR-FTK00903;AUTOMOTIVO;Pivô;KIT;SPARE;Par Pivô Da Bandeja Inferior Citroen C3 2002 A 2013;; R$ 24,00 ;;;;
PARFTK1004/05;AUTOMOTIVO;Pivô;KIT;SPARE;Par Pivô Inferior Bandeja Dianteira Gol 1980 À 1992;; R$ -   ;;;;
PARFTK11001/11018-MB;AUTOMOTIVO;Bucha Bandeja;KIT;MOBENSANI;Par Bucha Da Bandeja Dianteira Pajero Sport 2001 Em Diante;; R$ -   ;;;;
PARFTK11001-MB;AUTOMOTIVO;Bucha Bandeja;KIT;MOBENSANI;Par Bucha Traseira Da Bandeja Dianteira L200 Sport 03;; R$ -   ;;;;
PAR-FTK11003;AUTOMOTIVO;Pivô;KIT;SPARE;Par pivô Bandeja Inferior Ambos Os Lados Gol 1992 À 1997;; R$ -   ;;;;
PARFTK11004/06-AMW;AUTOMOTIVO;Bucha Bandeja;KIT;AMW;Par Bucha Da Bandeja Dianteira Gol G5 2008 Em Diante;; R$ -   ;;;;
PARFTK11019;AUTOMOTIVO;pivô;KIT;SPARE;Par Pivô Bandeja Inferior Dianteira Cordoba 93 À 02;; R$ 24,00 ;;;;
PAR-FTK11019;AUTOMOTIVO;Pivô;KIT;SPARE;Par Pivô Bandeja Inferior Dianteira Golf 93 À 98;; R$ -   ;;;;
PARFTK11019-MB;AUTOMOTIVO;Bucha Bandeja;KIT;MOBENSANI;Par Bucha Da Bandeja Dianteira L200 Sport 2003 Diante;; R$ -   ;;;;
PARFTK-11020;AUTOMOTIVO;Pivô;KIT;SPARE;Par Pivô Inferior Corcel 1971 Á 1986;; R$ -   ;;;;
PARFTK11021;AUTOMOTIVO;pivô;KIT;SPARE;Par Pivô Bandeja Inferior Ambos Lados Fiesta Street 96 À 07;; R$ 24,00 ;;;;
PAR-FTK11022;AUTOMOTIVO;Pivô;KIT;SPARE;Par Pivô Bandeja Inferior Escort 1993 A 1996;;  ;;;;
PAR-FTK11026;AUTOMOTIVO;Pastilha Freio;KIT;SPARE;Par Pivô Inferior Bandeja Dianteira Prisma 2006 À 2009;; R$ -   ;;;;
PARFTK11028-MB;AUTOMOTIVO;Bucha Bandeja;KIT;MOBENSANI;Par Bucha Da Bandeja Dianteira Pajero Io 2002 Em Diante;; R$ -   ;;;;
PARFTK11030;AUTOMOTIVO;Pivô;KIT;SPARE;Par pivô Bandeja Inferior Ambos Os Lados Kadett 1989 À 1998;; R$ -   ;;;;
PAR-FTK11032;AUTOMOTIVO;pivô;KIT;SPARE;Par Pivô Inferior Palio 2000 A 2016;; R$ 24,00 ;;;;
PAR-FTK11038;AUTOMOTIVO;Pivô;KIT;SPARE;Par Pivô Inferior Palio 1996 A 1999;; R$ -   ;;;;
PARFTK11042/43;AUTOMOTIVO;Pivô;KIT;SPARE;Par Pivô Bandeja Dianteira Spacefox 2006 A 2010;; R$ 24,00 ;;;;
PAR-FTK11045;AUTOMOTIVO;Pivô;KIT;SPARE;Par Pivô Inferior Bandeja Rav4 2000 Á 2005;; R$ -   ;;;;
PARFTK11048;AUTOMOTIVO;Pivô;KIT;SPARE;Par Pivô Da Bandeja Inferior C3;; R$ -   ;;;;
PAR-FTK11049/50;AUTOMOTIVO;Pivô;KIT;SPARE;Par Pivô Inferior Doblo Adventure 1.8 2003 A 2017;;;;;;
PAR-FTK11051;AUTOMOTIVO;Pivô;KIT;SPARE;Par Pivô Inferior Meriva 1.4 1.8 2003 A 2012;;;;;;
PARFTK11052/53;AUTOMOTIVO;Pivô;KIT;SPARE;Par Pivô Da Bandeja Strada Adventure Locker 2009 A 2017;; R$ 24,00 ;;;;
PARFTK11055;AUTOMOTIVO;Pivô;KIT;SPARE;Par Pivô Bandeja Dianteira Linea 2009 A 2017;; R$ 24,00 ;;;;
PAR-FTK11056/57;AUTOMOTIVO;Pivô;KIT;SPARE;Par Pivô Gol G5 2008 Em Diante Com Direção Hidraulica;; R$ 24,00 ;;;;
PARFTK11058;AUTOMOTIVO;Pivô;KIT;SPARE;Par Pivô Inferior Bandeja Dianteira Idea 2010 À 2018;;  ;;;;
PAR-FTK11058;AUTOMOTIVO;Pivô;KIT;SPARE;Par Pivô Da Bandeja Ambos Os Lados Idea 1.4 1.8 2006 A 2017;; R$ -   ;;;;
PAR-FTK11110;AUTOMOTIVO;Pivô;KIT;SPARE;Par Pivô Inferior I30 I Fd 2007 A 2012;; R$ -   ;;;;
PARFTK11140-MB;AUTOMOTIVO;Bucha Bandeja;KIT;MOBENSANI;Par Bucha Da Bandeja Superior Dianteira Blazer 1996 A 2011;; R$ -   ;;;;
PARFTK11203/04-MB;AUTOMOTIVO;Bucha Bandeja;KIT;MOBENSANI;Suporte Dianteiro E Bucha Traseira Bandeja Meriva 2002 A 13;; R$ -   ;;;;
PARFTK11203A/04-MB;AUTOMOTIVO;Bucha Bandeja;KIT;MOBENSANI;Par Bucha Bandeja Suspensão Dianteira Meriva 2002 A 2012;; R$ -   ;;;;
PARFTK11224/25-MB;AUTOMOTIVO;Bucha Bandeja;KIT;MOBENSANI;Par Bucha Da Bandeja Dianteira Spin 2013 Em Diante;; R$ -   ;;;;
PAR-FTK14272;AUTOMOTIVO;Rolamento Roda;KIT;IRB;Par Rolamento Roda Dianteira Subaru Impreza 1.8 1994 A 2007;; R$ -   ;;;;
PAR-FTK18005;AUTOMOTIVO;Rolamento roda;KIT;IRB;Par Rolamento Roda Dianteira Peugeot 306 1994 A 2001;; R$ -   ;;;;
PAR-FTK18045;AUTOMOTIVO;Rolamento Roda;KIT;IRB;Par Rolamento Roda Dianteira Lifan X60 2013 Em Diante;; R$ -   ;;;;
PAR-FTK18072;AUTOMOTIVO;Pastilha Freio;KIT;IRB;Par Rolamento Roda Dianteira Peugeot 208 1.5l 2013 A 2016;; R$ -   ;;;;
PAR-FTK18088;AUTOMOTIVO;Rolamento roda;KIT;IRB;Par Rolamento Roda Dianteira Punto 1.8 2008 Em Diante;; R$ -   ;;;;
PAR-FTK18096;AUTOMOTIVO;ROLAMENTO RODA;KIT;IRB;Par Rolamento Roda Traseira Crv 2.0 16v 2005 2006;; R$ -   ;;;;
PAR-FTK18102;AUTOMOTIVO;Rolamento Roda;KIT;IRB;Par Rolamento Roda Traseira Range Rover Sport 2010 A 2013;; R$ -   ;;;;
PAR-FTK18168;AUTOMOTIVO;Rolamento;KIT;IRB;Par Rolamento Roda Dianteira Tracker 2001 A 2009;; R$ -   ;;;;
PAR-FTK18169;AUTOMOTIVO;Bandeja;KIT;SPARE;Par Bandeja Com Pivô Uno Vivace 2010 Em Diante;; R$ -   ;;;;
PAR-FTK18193;AUTOMOTIVO;Rolamento roda;KIT;IRB;Par Rolamento Roda Dianteira Jac J3 2010 Em Diante 1.4 1.5;; R$ -   ;;;;
PAR-FTK18273;AUTOMOTIVO;Pastilha Freio;KIT;IRB;Par Rolamento Roda Traseira Bmw Série 3 328 2005 A 2007;; R$ -   ;;;;
PAR-FTK18505;AUTOMOTIVO;Pastilha Freio;KIT;IRB;Par Rolamento Roda Traseira Mercedes Ml350 2012 A 2019;; R$ -   ;;;;
PAR-FTK18583;AUTOMOTIVO;Bandeja;KIT;SPARE;Par Bandeja Inferior Com Pivô Santana 1988 A 2006;; R$ -   ;;;;
PAR-FTK18627;AUTOMOTIVO;Rolamento Roda;KIT;IRB;Par Rolamento Roda Dianteira Amarok 2011 Em Diante;; R$ -   ;;;;
PAR-FTK18630;AUTOMOTIVO;Pastilha Freio;KIT;IRB;Par Rolamento Roda Traseira Amarok 2010 A 2019 2.0 3.0;; R$ -   ;;;;
PAR-FTK18647;AUTOMOTIVO;Rolamento;KIT;IRB;Par Rolamento Roda Dianteira Ranger Março 2012 Em Diante;; R$ -   ;;;;
PARFTK22002/03;AUTOMOTIVO;Pivô;KIT;SPARE;Pivô Da Bandeja Inferior Lado Esquerdo New Civic 2006 A 2011;;  ;;;;
PAR-FTK22104;AUTOMOTIVO;Pivô;KIT;SPARE;Par Pivô Da Bandeja Dianteira Ix35 2010 A 2017;; R$ 24,00 ;;;;
PARFTK22182;AUTOMOTIVO;Pivô;KIT;SPARE;Par Pivô Inferior Da Bandeja Clio 1996 A 2003;; R$ 24,00 ;;;;
PAR-FTK22182;AUTOMOTIVO;Pivô;KIT;SPARE;Par Pivô Inferior Da Bandeja Scenic 1998 A 2010;; R$ 24,00 ;;;;
PAR-FTK22183;AUTOMOTIVO;Pivô;KIT;SPARE;Par Pivô Da Bandeja Dianteira Megane 1996 A 2005;; R$ 24,00 ;;;;
PARFTK222014;AUTOMOTIVO;Pivô;KIT;SPARE;Par Pivô De Suspensão Inferior Ranger 4x2 4x4 1998 A 2012;;  ;;;;
PARFTK22208/2263-MB;AUTOMOTIVO;Bucha Bandeja;KIT;MOBENSANI;Par Bucha Da Bandeja Dianteira Courier 1997 A 2002;; R$ -   ;;;;
PARFTK22286-GP;AUTOMOTIVO;Bucha Bandeja;KIT;GUARU BORRACHAS;Par Bucha Bandeja Superior Dianteira Ranger 2012 Em Diante;;  ;;;;
PAR-FTK279/82;AUTOMOTIVO;Pastilha Freio;KIT;Replabor;Par Coifa Homocinetica Cobalt 1.8 2013 A 2016;; R$ -   ;;;;
PAR-FTK313;AUTOMOTIVO;Coxim Amortecedor;KIT;RE9BOR;Par Coxim Amortecedor Dianteiro Saveiro 1980 A 1995;; R$ -   ;;;;
PAR-FTK314;AUTOMOTIVO;Coifa Homocinética;KIT;Replabor;Par Coifa Homocinetica Lado Roda Fiat 147 1976 A 1986;; R$ -   ;;;;
PARFTK33006-AMW;AUTOMOTIVO;Bucha Bandeja;KIT;AMW;Par Bucha Do Braço Superior Dianteiro Explorer 96 97;; R$ 25,02 ;;;;
PARFTK33028-MB;AUTOMOTIVO;Bucha Bandeja;KIT;MOBENSANI;Par Bucha Central Da Bandeja Inferior Amarok 2010 Em Diante;; R$ -   ;;;;
PARFTK33029-MB;AUTOMOTIVO;Bucha Bandeja;KIT;MOBENSANI;Par Bucha Da Bandeja Superior Amarok 2010 Em Diante;; R$ -   ;;;;
PAR-FTK3320K;AUTOMOTIVO;Coifa Homocinética;KIT;Replabor;Par Coifa Semi Eixo Lado Câmbio Fiorino 1980 A 2009;;  ;;;;
PAR-FTK3321K;AUTOMOTIVO;Coifa Homocinética;KIT;Replabor;Par Coifa Semi Eixo Câmbio Fiat Cronos 2017 Em Diante;; R$ 13,82 ;;;;
PAR-FTK3322K;AUTOMOTIVO;Coifa Homocinética;KIT;Replabor;Par Coifa Homocinética Lado Roda Fiat Uno 1991 A 2012 Todos;; R$ -   ;;;;
PARFTK33395;AUTOMOTIVO;Pivô;KIT;SPARE;Par Pivô Inferior Da Bandeja Dianteira Fiesta 2002 A 2014;; R$ -   ;;;;
PAR-FTK33395;AUTOMOTIVO;pivô;KIT;SPARE;Par Pivô Inferior Da Bandeja Dianteira Ecosport 2003 A 2013;; R$ 24,00 ;;;;
PAR-FTK411;AUTOMOTIVO;Coifa Homocinética;KIT;Replabor;Par Coifa Homocinetica Lado Roda Parati 1980 A 2008;; R$ -   ;;;;
PARFTK44002/03-AMW;AUTOMOTIVO;Bucha Bandeja;KIT;AMW;Par Bucha Lado Esquerdo Bandeja Dianteira Tempra 93 Diante;; R$ 51,52 ;;;;
PARFTK44002/06-AMW;AUTOMOTIVO;Bucha Bandeja;KIT;AMW;Par Bucha Lado Direito Bandeja Dianteira Marea 98 Em Diante;; R$ -   ;;;;
PARFTK44005-AMW;AUTOMOTIVO;Bucha Bandeja;KIT;AMW;Par Bucha Da Bandeja Suspensão Traseira Fiat 147 83 A 86;; R$ -   ;;;;
PARFTK4476/44406-MB;AUTOMOTIVO;Bucha Bandeja;KIT;MOBENSANI;Par Bucha Da Bandeja Dianteira Linea 2008 A 2017;; R$ -   ;;;;
PARFTK4476/77-MB;AUTOMOTIVO;Bucha Bandeja;KIT;MOBENSANI;Par Bucha Da Bandeja Dianteira Stilo 2002 A 2010;; R$ -   ;;;;
PAR-FTK452;AUTOMOTIVO;Coifa Homocinética;KIT;Replabor;Par Coifa Homocinetica Lado Roda Crossfox 2004 Em Diante;; R$ -   ;;;;
PAR-FTK616/25;AUTOMOTIVO;Pastilha Freio;KIT;Replabor;Par Coifa Homocinetica Peugeot 2008 1.6 2016 Em Diante;; R$ -   ;;;;
PARFTK66000/01MB;AUTOMOTIVO;Bucha Bandeja;KIT;MOBENSANI;Par Bucha Da Bandeja Dianteira City 2010 A 2014;; R$ -   ;;;;
PARFTK66029/39-MB;AUTOMOTIVO;Bucha Bandeja;KIT;MOBENSANI;Par Bucha Da Bandeja Dianteira Crv 2007 A 2012;; R$ -   ;;;;
PAR-FTK717/28;AUTOMOTIVO;Coifa Homocinética;KIT;Replabor;Par Coifa Homocinetica Lado Cambio Logan 2007 Em Diante;; R$ -   ;;;;
PARFTK77001-AMW;AUTOMOTIVO;Bucha Bandeja;KIT;AMW;Par Bucha Dianteira Da Bandeja Dianteira Berlingo;; R$ 11,61 ;;;;
PARFTK77014/15-MB;AUTOMOTIVO;Bucha Bandeja;KIT;MOBENSANI;Par Bucha Da Bandeja Dianteira Livina 2010 A 2014;; R$ -   ;;;;
PAR-FTK77365/66;AUTOMOTIVO;Pivô;KIT;SPARE;Par Pivô Inferior Audi A3 1999 A 2006;; R$ -   ;;;;
PARFTK7739/40-MB;AUTOMOTIVO;Bucha Bandeja;KIT;MOBENSANI;Par Bucha Bandeja Dianteira Corolla 1997 A 2002;; R$ -   ;;;;
PARFTK7741/42-MB;AUTOMOTIVO;Bucha Bandeja;KIT;MOBENSANI;Par Bucha Da Bandeja Dianteira Corolla 2003 Em Diante;; R$ -   ;;;;
PARFTK77503-AMW;AUTOMOTIVO;Bucha Bandeja;KIT;AMW;Par Bucha Da Bandeja Dianteira Kangoo 1997 Em Diante;; R$ 19,64 ;;;;
PARFTK99082-MB;AUTOMOTIVO;Bucha Bandeja;KIT;MOBENSANI;Par Bucha Traseira Da Bandeja Dianteira Mondeo 1996 A 2001;; R$ -   ;;;;
PARFTK99083-MB;AUTOMOTIVO;Bucha Bandeja;KIT;MOBENSANI;Par Bucha Dianteira Da Bandeja Dianteira Mondeo 1993 A 2001;; R$ -   ;;;;
PARFTK99103/04-MB;AUTOMOTIVO;Bucha Bandeja;KIT;MOBENSANI;Par Bucha Da Bandeja Dianteira Megane 2007 Em Diante;; R$ -   ;;;;
PARFTK99128/29-MB;AUTOMOTIVO;Bucha Bandeja;KIT;MOBENSANI;Par Bucha Da Bandeja Dianteira Fluence 2010 Em Diante;; R$ -   ;;;;
PARFTK99140-MB;AUTOMOTIVO;Bucha Bandeja;KIT;MOBENSANI;Par Bucha Da Bandeja Superior Dianteira Civic 1996 A 2000;; R$ -   ;;;;
PARFTK99171-MB;AUTOMOTIVO;Bucha Bandeja;KIT;MOBENSANI;Par Bucha Da Bandeja Superior Dianteira Civic 1992 A 1995;; R$ -   ;;;;
PARFTK99325-MB;AUTOMOTIVO;Bucha Bandeja;KIT;MOBENSANI;Par Bucha Da Bandeja Dianteira Sandero 2007 Em Diante;; R$ -   ;;;;
PARFTK99370/71-MB;AUTOMOTIVO;Bucha Bandeja;KIT;MOBENSANI;Par Bucha Da Bandeja Dianteira Kwid 2017 Em Diante;; R$ -   ;;;;
Par-GM001;AUTOMOTIVO;Rolamento Roda;KIT;POLO;Par Kit Rolamento Roda Traseira Corsa 1.4 8/16v 1994 A 2002;; R$ 27,80 ;;;;
PAR-LT5577;AUTOMOTIVO;Haste Câmbio;KIT;LT CORREA;Par Haste Do Trambulador 230mm Golf 1998 Á 2001 Motor 1.6;; R$ 24,00 ;;;;
PAR-NZT0012;AUTOMOTIVO;Rolamento Roda;KIT;POLO;Rolamento Da Roda Dianteira Sem Abs;; R$ 63,98 ;;;;
PAR-NZT0186;AUTOMOTIVO;Rolamento Roda;KIT;Polo;Par Rolamento Roda Dianteiro Peugeot 406 1997 A 2003;; R$ -   ;;;;
PAR-NZT1206;AUTOMOTIVO;Rolamento;KIT;POLO;Par Rolamento Roda Traseira Fusion Com Abs;; R$ -   ;;;;
par-nzt311315;AUTOMOTIVO;Rolamento Roda;KIT;POLO;Par Rolamento Da Roda Dianteira Sem Abs Parati Gol Até 1994;; R$ -   ;;;;
Par-NZT311396;AUTOMOTIVO;Rolamento Roda;KIT;POLO;Par Rolamento Da Roda Dianteira Sem Abs Chery;; R$ 73,60 ;;;;
PAR-NZT3600;AUTOMOTIVO;Rolamento Roda;KIT;POLO;2 Kits Rolamento Roda Dianteira Corsa Frente Montana;; R$ 85,43 ;;;;
PAR-NZT3601;AUTOMOTIVO;Rolamento Roda;KIT;POLO;2 Kits Rolamento Roda Traseira Meriva Corsa Montana;; R$ 123,26 ;;;;
PAR-NZT563644;AUTOMOTIVO;Pastilha Freio;KIT;POLO;Par Rolamento Roda Dianteira Onix 1.0 1.4 2012 Em Diante;; R$ -   ;;;;
par-nzt636114;AUTOMOTIVO;Rolamento Roda;KIT;POLO;Par Rolamento Da Roda Dianteira Sem Abs Prisma Corsa Classic;; R$ -   ;;;;
Par-PF005;AUTOMOTIVO;Rolamento Eixo;KIT;Importação;Par Reparo Rolamento Eixo Traseiro Palio Weekend Marea Brava;; R$ 21,00 ;;;;
PAR-PFTK22183;AUTOMOTIVO;Pivô;KIT;SPARE;Par Pivô Da Bandeja Dianteira R19 1988 A 1997;;  ;;;;
Par-PG001;AUTOMOTIVO;Rolamento Eixo;KIT;Importação;Kit Rolamento Eixo Traseiro Peugeot206/207 C/barra 47mm;; R$ 86,00 ;;;;
Par-PG001A;AUTOMOTIVO;Rolamento Eixo;KIT;Importação;Kit Rolamento Eixo Traseiro Peugeot 206/207 C/barra 50mm;; R$ 86,00 ;;;;
Par-PG002;AUTOMOTIVO;Rolamento Eixo;KIT;Importação;Kit Rolamento 47mm Suspensão Tras 206/207 S/barra Estabiliza;; R$ 90,00 ;;;;
Par-PG003;AUTOMOTIVO;Rolamento Eixo;KIT;Importação;2 Kit's De Rolamento Eixo Traseiro Xsara Picasso 2001 A 2011;; R$ 45,30 ;;;;
par-pivô442090;AUTOMOTIVO;Pivô;KIT;SPARE;Par Pivô Gol G5 2008 Em Diante Com Direção Hidraulica;; R$ -   ;;;;
PAR-PVI0311;AUTOMOTIVO;Pivô;KIT;SPARE;Par Pivô Bandeja Sonic 2012 Em Diante;;  ;;;;
PAR-PVI0605;AUTOMOTIVO;Pivô;KIT;SPARE;Par Pivô Da Bandeja Dianteira Oroch 2014 A 2019;; R$ 24,00 ;;;;
PAR-PVI0606;AUTOMOTIVO;Pivô;KIT;SPARE;Par Pivô Bandeja Dianteira  Fluence 2011 Em Diante;; R$ 24,00 ;;;;
PAR-PVI0903;AUTOMOTIVO;Pivô;KIT;SPARE;Par Pivô Da Bandeja Inferior Citroen C3 2002 A 2013;; R$ -   ;;;;
PAR-PVI1003;AUTOMOTIVO;Pivô;KIT;SPARE;Par pivô Bandeja Inferior Ambos Os Lados Gol 1992 À 1997;;  ;;;;
PAR-PVI1004/05;AUTOMOTIVO;Pivô;KIT;SPARE;Par Pivô Inferior Bandeja Dianteira Parati 1983 À 1992;; R$ 24,00 ;;;;
PAR-PVI1019;AUTOMOTIVO;Pivô;KIT;SPARE;Par Pivô Bandeja Inferior Dianteira Cordoba 93 À 02;;  ;;;;
PAR-PVI1021;AUTOMOTIVO;Pivô;KIT;SPARE;Par Pivô Bandeja Inferior Ambos Lados Fiesta Street 96 À 07;; R$ 24,00 ;;;;
PAR-PVI1022;AUTOMOTIVO;Pivô;KIT;SPARE;Par Pivô Bandeja Inferior Verona 1993 A 1996;;  ;;;;
PAR-PVI1026;AUTOMOTIVO;Pivô;KIT;SPARE;Par Pivô Inferior Bandeja Dianteira Tigra 1997 À 2000;;  ;;;;
