SKU;SEGUIMENTO;Categoria;TIPO;Fornecedor;Descrição / Aplicação;"Código Do 
Fornecedor";" CMV 
Unitário ";"Altura
(cm)";"Comprimento
(cm)";"Largura
(cm)";Peso
20w50-SB;AUTOMOTIVO;Óleo;SIMPLES;;20W50 OLEO MOTOR RB LUBRIFICANTES  ;;;;;;
2214/15;AUTOMOTIVO;Haste câmbio;KIT;LT CORREA;Kit Tirante Externo Do Câmbio Partner 1.8;;;;;;
222010b;AUTOMOTIVO;Bandeja;SIMPLES;SPARE;Braço Oscilante Direito Com Bucha Verona 1990 A 1992;; R$ 15,50 ;;;;
222011b;AUTOMOTIVO;Bandeja;SIMPLES;SPARE;Braço Oscilante Esquerdo Com Bucha Apollo 1990 A 1992;;  ;;;;
222053/54;AUTOMOTIVO;Bandeja;KIT;SPARE;Par Bandeja Dianteira Com Pivô Ecosport 2003 A 2011;; R$ 94,16 ;;;;
222063/64;AUTOMOTIVO;Bandeja;KIT;SPARE;Par Bandeja Inferior Ka Direção Hidráulica Com Pivô 08 Á 13;;  ;;;;
222072/73;AUTOMOTIVO;Bandeja;KIT;SPARE;Par Bandeja Inferior Fiesta Sem Pivô;;  ;;;;
222104/05;AUTOMOTIVO;Bandeja;KIT;SPARE;Par Bandeja Inferior Fiesta Com Pivô;;  ;;;;
222308/09;AUTOMOTIVO;Bandeja;KIT;SPARE;Par Bandeja Inferior Com Pivô Edge 2008 A 2015;;  ;;;;
2360-D;AUTOMOTIVO;Suporte Radiador;SIMPLES;LT CORREA;Suporte Radiador Lado Direito - Corsa Gl 1.6 - 2006;; R$ -   ;;;;
2360-E;AUTOMOTIVO;Suporte Radiador;SIMPLES;LT CORREA;Suporte Radiador Lado Esquerdo - Corsa Gl 1.6 - 2006;; R$ -   ;;;;
2362-DE;AUTOMOTIVO;Suporte Radiador;SIMPLES;LT CORREA;Suporte Sup. Radiador Celta 2010 Le/ld;; R$ -   ;;;;
2362-LD;AUTOMOTIVO;Suporte Radiador;SIMPLES;LT CORREA;Suporte Superior Radiador Celta 2005 Lado Direito;; R$ -   ;;;;
2362-LE;AUTOMOTIVO;Suporte Radiador;SIMPLES;LT CORREA;Suporte Superior Radiador Prisma/celta Lado Esquerdo;; R$ -   ;;;;
2367-E;AUTOMOTIVO;;SIMPLES;;;; R$ -   ;;;;
2kits-12152;AUTOMOTIVO;Pino de Porta;KIT;MultiKit;2 Kits Pino Buchas Dobradiça Porta Belina 1989;; R$ 11,80 ;;;;
330178/79;AUTOMOTIVO;AMORTECEDOR SUSPENSÃO;KIT;SPARE;Par Amortecedor  Dianteiro 207 Todos Os Modelos Hatch;; R$ -   ;;;;
332002/03;AUTOMOTIVO;Bandeja;KIT;SPARE;Par Bandeja Superior Sem Pivô Chevy500 1984 À 1995;; R$ 44,00 ;;;;
332014/15;AUTOMOTIVO;Bandeja;KIT;SPARE;Par Braço Suspensão Tigra 1997 A 2000;;  ;;;;
332042/43;AUTOMOTIVO;Bandeja;KIT;SPARE;Par Morceguinho Corsa 1994 A 1998;; R$ 38,00 ;;;;
332056/57;AUTOMOTIVO;Bandeja;KIT;SPARE;Par Morceguinho Dianteira Montana 2011 A 2016;; R$ 38,00 ;;;;
332081/82;AUTOMOTIVO;Bandeja;KIT;SPARE;Par Bandeja Inferior Com Pivô Astra 1999 A 2011;;  ;;;;
332090-1;AUTOMOTIVO;Bandeja;KIT;SPARE;Par Bandeja Inferior Onix 2013 Em Diante Sem Pivô;;  ;;;;
332092-5233;AUTOMOTIVO;Pivô e Bieleta;KIT;SPARE / HOLYMAN; Com Pivô E Bieleta Direito Sonic 2012 Em Diante;;  ;;;;
332093-5233;AUTOMOTIVO;Pivô e Bieleta;KIT;SPARE / HOLYMAN; Com Pivô E Bieleta Esquerdo Sonic 2012 Em Diante;;  ;;;;
332112/13;AUTOMOTIVO;Bandeja;KIT;SPARE;Par Bandeja Inferior Com Pivô Marajó 1973 A 1993;; R$ -   ;;;;
332116/17;AUTOMOTIVO;Bandeja;KIT;SPARE;Par Bandeja Dianteira Inferior Com Pivô Daewoo E 1994 À 1998;;  ;;;;
332136/37;AUTOMOTIVO;Bandeja;KIT;SPARE;Par Bandeja Inferior Caravan 1980 Até 1992 Sem Pivô;; R$ -   ;;;;
332138/39;AUTOMOTIVO;Bandeja;KIT;SPARE;Par Bandeja Inferior Opala 1969 Á 1979  Sem Pivô;; R$ -   ;;;;
332147/48;AUTOMOTIVO;Bandeja;KIT;SPARE;Par Bandeja Superior Caravan 1975 A 1992;;  ;;;;
4004r;AUTOMOTIVO;Capa Pedal;SIMPLES;HOLYMAN;Capa Pedal Acelerador Freio Embreagem Rosa Kadett 89 A 98;; R$ 2,55 ;;;;
4017C;AUTOMOTIVO;Capa Pedal;SIMPLES;HOLYMAN;Kit Capa Pedal Acelerador Freio Embregaem Brasília;; R$ 5,61 ;;;;
442070/71;AUTOMOTIVO;Bandeja;KIT;SPARE;Par Bandeja Inferior Sem Pivô Ranger 2012 A 2019;;  ;;;;
442081/82;AUTOMOTIVO;Bandeja;KIT;SPARE;Par Bandeja Superior Sem Pivô Del Rey 1984 À 1991;; R$ 62,62 ;;;;
442090/01;AUTOMOTIVO;Bandeja;KIT;SPARE;Par Bandeja Sem Pivô Crossfox 2014 Em Diante;;  ;;;;
442090/91-PAR5307;AUTOMOTIVO;Bandeja e Bieleta;KIT;SPARE / HOLYMAN;Par Bandeja Sem Pivô Com Bieleta Fox 2014;;;;;;
442090-1;AUTOMOTIVO;BANDEJA;KIT;SPARE;Par Bandeja Sem Pivô Gol G5 2008 Em Diante;; R$ -   ;;;;
442090-5307;AUTOMOTIVO;Bandeja e Bieleta;KIT;SPARE / HOLYMAN;BandejA Sem Pivô Com Bieleta Ld Saveiro G6 2012 A 2016;; R$ 55,40 ;;;;
442091-5307;AUTOMOTIVO;Bandeja e Bieleta;KIT;SPARE / HOLYMAN;BandejA Sem Pivô Com Bieleta Le Crossfox 2014 A 2016;; R$ 50,40 ;;;;
442092-3;AUTOMOTIVO;Bandeja;KIT;SPARE;Par Bandeja Gol G5 2008 Em Diante Com Direção Hidraulica;; R$ 91,30 ;;;;
442092-5307;AUTOMOTIVO;Bandeja e Bieleta;KIT;SPARE / HOLYMAN;BandejA Com Pivô E Bieleta Direito Crossfox 2014 A 2016;;  ;;;;
442093-5307;AUTOMOTIVO;Bandeja e Bieleta;KIT;SPARE / HOLYMAN;Bandeja Com Pivô E Bieleta Esquerdo Voyage G5 2008 A 2016;;  ;;;;
442096/97;AUTOMOTIVO;Bandeja;KIT;SPARE;Par Bandeja Dianteira Com Pivô Fox 2003 A 2014;; R$ 103,30 ;;;;
442104P;AUTOMOTIVO;BANDEJA;SIMPLES;SPARE;Bandeja Inferior Direito Com Pivô Tiguan 2010 A 2017;; R$ -   ;;;;
442105P;AUTOMOTIVO;Bandeja;SIMPLES;SPARE;Bandeja Inferior Esquerda Com Pivô Passat Cc 2009 2010;;  ;;;;
442118/19;AUTOMOTIVO;Bandeja;KIT;SPARE;Par Bandeja Inferior Com Pivô Amarok 2010 A 2020 2.0;;  ;;;;
442122P;AUTOMOTIVO;Bandeja;SIMPLES;SPARE;Bandeja Inferior Direita Jetta 2.0 2.5 2005 A 2010 Com Pivô;;  ;;;;
442123P;AUTOMOTIVO;Bandeja;SIMPLES;SPARE;Bandeja Inferior Esquerda Jetta 2.0 2.5 2005 A 2010 Com Pivô;; R$ 23,00 ;;;;
44911/12;AUTOMOTIVO;Cabo Câmbio;SIMPLES;Importação;Cabo De Marcha Gm Astra Zafira 2008;; R$ 80,29 ;;;;
4kit-12152;AUTOMOTIVO;Pino de Porta;KIT;MultiKit;4kits Pino Bucha Dobradiçaporta Corcel,delrey,pampa,belina;; R$ 23,60 ;;;;
4KIT-14098;AUTOMOTIVO;Pino de Porta;KIT;MultiKit;4 Kits Pino Da Dobradiça Porta Palio G3 Fire 2015 2016;; R$ -   ;;;;
4kits14097/99;AUTOMOTIVO;Pino de Porta;KIT;MultiKit;4 Kits Pino Dobradiça Porta  Ld Le Elba 1987 1988;; R$ 23,20 ;;;;
4Kits-14097/99;AUTOMOTIVO;Pino de Porta;KIT;MultiKit;4 Kits Pino Dobradiça Porta  Ld Le Prêmio 1989 1990;; R$ 30,40 ;;;;
5108/09;AUTOMOTIVO;Bieleta;KIT;HOLYMAN;Par Bieleta Dianteira Palio Weekend;; R$ 30,24 ;;;;
5227/8;AUTOMOTIVO;Bieleta;KIT;HOLYMAN;Par Bieleta Dianteira Le Ld Captiva 2008 A 2015;; R$ 34,51 ;;;;
5231/2;AUTOMOTIVO;Bieleta;KIT;HOLYMAN;Bieleta Dianteira Ld S10 Trailblazer 2012 Em Diante;; R$ 34,40 ;;;;
5402/03;AUTOMOTIVO;Bieleta;KIT;HOLYMAN;Par Bieleta Dianteira Honda Civic 2001 A 2006 Ambos Os Lados;; R$ 33,00 ;;;;
5410-5411;AUTOMOTIVO;Bieleta;KIT;HOLYMAN;Bieleta Dianteira New Civic 2011 Ld Le;; R$ 32,40 ;;;;
552001/02;AUTOMOTIVO;Bandeja;KIT;SPARE;Par Bandeja Peugeot 207 Exceto Sw Escapade 2008 Em Diante;; R$ 130,00 ;;;;
552001-2;AUTOMOTIVO;BANDEJA;KIT;SPARE;Par Bandeja Peugeot 207 Exceto Sw Escapade 2008 Em Diante;; R$ -   ;;;;
552001-5701;AUTOMOTIVO;Bandeja e Bieleta;KIT;SPARE / HOLYMAN;Bandeja E Bieleta Lado Esquerd Peugeot 206 Todos 1999 A 2010;; R$ 83,12 ;;;;
552002-5701;AUTOMOTIVO;Bandeja e Bieleta;KIT;SPARE / HOLYMAN;Bandeja E Bieleta Lado Direito Peugeot 206 Todos 1999 A 2010;; R$ 84,12 ;;;;
552006/07;AUTOMOTIVO;Bandeja;KIT;SPARE;Par Bandeja Com Pivô AX 96/ - inferior ;; R$ -   ;;;;
552012/13;AUTOMOTIVO;Bandeja;KIT;SPARE;Par Bandeja Inferior Com Pivô C3 2002 À 2013;;  ;;;;
552014/15;AUTOMOTIVO;Bandeja;KIT;SPARE;Par Bandeja C4 Pallas 2007 Á 2013;; R$ 96,00 ;;;;
552017/18;AUTOMOTIVO;Bandeja;KIT;SPARE;Par Bandeja Inferior Sem Pivô Partner 1991 A 1998;;  ;;;;
552030/1;AUTOMOTIVO;Bandeja;KIT;SPARE;Par Bandeja Inferior Peugeot Partner;; R$ 122,76 ;;;;
552032/33;AUTOMOTIVO;Bandeja;KIT;SPARE;Par Bandeja Inferior Com Pivô Citroen C3 2013 A 2022;; R$ 91,28 ;;;;
552032/PVI0903;AUTOMOTIVO;Bandeja;SIMPLES;SPARE;Bandeja Inferior Direita Com Pivô Citroen C3 2013 A 2022;; R$ 23,00 ;;;;
552033/PVI0903;AUTOMOTIVO;Bandeja;SIMPLES;SPARE;Bandeja Inferior Esquerda Com Pivô Peugeot 208 2013 A 2022;; R$ 23,00 ;;;;
55323/111288;AUTOMOTIVO;Cabo de Capô;KIT;MundiFlex;Par Cabo De Capô Sem Alavanca Amarok 2010 Em Diante;; R$ 42,00 ;;;;
5913/5914;AUTOMOTIVO;Bieleta;KIT;HOLYMAN;Par Bieleta Dianteira Ld Le L200 Triton 4x4 2007 A 2013;; R$ 34,56 ;;;;
5W30;AUTOMOTIVO;Óleo;SIMPLES;;OLEO 5W30 SB LUBRIFICANTES  ;;;;;;
5W30-MAX;AUTOMOTIVO;ÓLEO MOTOR AUTOMOTIVO;SIMPLES;Maxi Lub;Óleo 5W30 Maxi Lubrificantes  ;;;;;;
5W30-SB;AUTOMOTIVO;Óleo;SIMPLES;;OLEO 5W30 SB LUBRIFICANTES  ;;;;;;
6310/11;AUTOMOTIVO;Bieleta;KIT;HOLYMAN;Par Bieleta Dianteira Kia Soul 2009 A 2015;; R$ 34,56 ;;;;
6509/6510;AUTOMOTIVO;Bieleta;KIT;HOLYMAN;Par Bieleta Traseira Mercedes C180 2008 A 2014;; R$ 82,08 ;;;;
662024/25;AUTOMOTIVO;Bandeja;KIT;SPARE;Par Bandeja  Clio Inferior 2005 Á 2016 Sem Pivô;;  ;;;;
662030/31;AUTOMOTIVO;Bandeja;KIT;SPARE;Par Bandeja Com Pivô Megane Grand Tour 2006 A 2012;; R$ -   ;;;;
662040/41;AUTOMOTIVO;Bandeja;KIT;SPARE;Par Bandeja Fluence 2011  Á 2018;;  ;;;;
662046/47;AUTOMOTIVO;Bandeja;KIT;SPARE;Par Bandeja Dianteira Com Pivô Logan 2014 A 2019;; R$ 114,26 ;;;;
662048/49;AUTOMOTIVO;Bandeja;KIT;SPARE;Par Bandeja Dianteira Sem Pivô Sandero 2014 A 2019;;  ;;;;
662050/51;AUTOMOTIVO;Bandeja;KIT;SPARE;Par Bandeja Dianteira Sem Pivô Sandero 2008 A 2014;;  ;;;;
662060/61;AUTOMOTIVO;Bandeja;KIT;SPARE;Par Bandeja Inferior Oroch Sem Pivô 2015 Á 2020;; R$ 44,00 ;;;;
662070/71;AUTOMOTIVO;Bandeja;KIT;SPARE;Par Bandeja Dianteira Com Pivô Oroch 2012 A 2016;; R$ 113,90 ;;;;
66300/1;AUTOMOTIVO;Cabo de Freio;KIT;MundiFlex;Par Cabo De Freio Traseiro Siena Attractive Elx 2008 Diante;; R$ 43,30 ;;;;
66610/11;AUTOMOTIVO;Cabo Câmbio;KIT;Importação;Cabo Duplo De Câmbio Palio 1.0 1996 A 2000;; R$ 78,00 ;;;;
66642/43;AUTOMOTIVO;Cabo Câmbio;KIT;Importação;Cabo Engate Seleção Palio Weekend Adventure 2011 Em Diante;; R$ 78,00 ;;;;
70526/70541;AUTOMOTIVO;Reparo alavanta Câmbio;KIT;BRK;Kit Reparo Alavanca Cambio Completo Del Rey 1990 À 1997;; R$ 47,04 ;;;;
772001/02;AUTOMOTIVO;Bandeja;SIMPLES;SPARE;Par Bandeja Fit Inferior 2003 Á 2008 Sem Pivô;;  ;;;;
772003/04;AUTOMOTIVO;Bandeja;KIT;SPARE;Par Bandeja Inferior Com Pivô Fit 2003 A 2007 1° Geração;;;;;;
772005/06;AUTOMOTIVO;Bandeja;SIMPLES;SPARE;Par Bandeja Dianteira Sem Pivô Honda Fit 2014 2°geração;;  ;;;;
772007/08;AUTOMOTIVO;Bandeja;KIT;SPARE;Par Bandeja Dianteira Com Pivô Honda Fit 2009 A 2013;; R$ 142,80 ;;;;
772029/30;AUTOMOTIVO;Bandeja;KIT;SPARE;Par Bandeja Inferior Corolla 1997 Á 2002;;  ;;;;
772033/34;AUTOMOTIVO;Bandeja;KIT;SPARE;Par Bandeja Dianteira Corolla 2002 Á 2019 Com Pivô;; R$ -   ;;;;
772040/41;AUTOMOTIVO;Bandeja;KIT;SPARE;Par Bandeja Dianteira Hilux 2005 A 2015 Com Pivô;;  ;;;;
772054p;AUTOMOTIVO;BANDEJA;KIT;SPARE;Bandeja Direita Inferior Com Pivô Kia Cerato 2009 Em Diante;; R$ -   ;;;;
772055P;AUTOMOTIVO;BANDEJA;KIT;SPARE;Bandeja Esquerda Inferior Com Pivô I30 2008 A 2012;; R$ -   ;;;;
772056/57;AUTOMOTIVO;Bandeja;KIT;SPARE;Par Bandeja Inferior Com Pivô Kia Cerato 2009 Em Diante;; R$ 139,48 ;;;;
772058/59;AUTOMOTIVO;Bandeja;KIT;SPARE;Par Bandeja Dianteira Sem Pivô Hyundai Ix35 2010 A 2015;;  ;;;;
772090/91;AUTOMOTIVO;Bandeja;KIT;SPARE;Par Bandeja Dianteira  Mondeo 1994 A 2001 Com Pivô;; R$ -   ;;;;
772110/11;AUTOMOTIVO;Bandeja;KIT;SPARE;Par Bandeja Dianteira Sentra 2007 A 2012 Com Pivô;;  ;;;;
772112/13;AUTOMOTIVO;Bandeja;KIT;SPARE;Par Bandeja Inferior Sem Pivô Nissan Sentra 2013 À 2020;;  ;;;;
772134/35;AUTOMOTIVO;Bandeja;KIT;SPARE;Par Bandeja Superior Civic 1996 A 2001 Com Pivô;;  ;;;;
772138/39;AUTOMOTIVO;Bandeja;KIT;SPARE;Par Bandeja Dianteira Sem Pivô Civic 2011 A 2016;; R$ 128,54 ;;;;
772144/45;AUTOMOTIVO;Bandeja;KIT;SPARE;Par Bandeja Hb20 Hatch 2012 A 2019;;  ;;;;
772144P;AUTOMOTIVO;Bandeja;SIMPLES;SPARE;BANDEJA LADO DIREITO;; R$ -   ;;;;
772145P;AUTOMOTIVO;Bandeja;SIMPLES;SPARE;BANDEJA LADO ESQUERDO HB20 HATCH 2012 A 2019;; R$ -   ;;;;
772146/47;AUTOMOTIVO;Bandeja;KIT;SPARE;Bandeja Lado Direito Hb20 2012 A 2019 Com Pivô;;#VALOR!;;;;
772148/49;AUTOMOTIVO;Bandeja;KIT;SPARE;Par Bandeja Dianteira Com Pivô Sportage 2011 A 2022;; R$ 43,00 ;;;;
772150/51;AUTOMOTIVO;Bandeja;KIT;SPARE;Par Bandeja Inferior Sem Pivô Vera Cruz 2007 À 2012;;  ;;;;
772152/53;AUTOMOTIVO;Bandeja;KIT;SPARE;Par Bandeja Inferior Com Pivô Sorento 2009 À 2012;; R$ 44,00 ;;;;
772170/71;AUTOMOTIVO;BANDEJA;KIT;SPARE;Par Bandeja Dianteira Picanto 2011 Á 2020;; R$ -   ;;;;
772204/05;AUTOMOTIVO;Bandeja;KIT;SPARE;Par Bandeja Superior Jinbei Topic 2008 Á 2017 Completa;; R$ -   ;;;;
772221/22;AUTOMOTIVO;Bandeja;KIT;SPARE;Par Bandeja Dianteira Inferior Sem Pivô Outlander 07 À 13;;  ;;;;
772233/34;AUTOMOTIVO;BANDEJA;KIT;SPARE;Par Bandeja Dianteira Journey 2009 Á 2015;; R$ -   ;;;;
772246/47;AUTOMOTIVO;Bandeja;KIT;SPARE;Par Bandeja Inferior Com Pivô Etios 2012 A 2018;;  ;;;;
772254/55;AUTOMOTIVO;Bandeja;KIT;SPARE;Par Bandeja Superior Dianteira Com Pivô Sw4 06 À 20;; R$ 138,18 ;;;;
772256/57;AUTOMOTIVO;Bandeja;KIT;SPARE;Par Bandeja Inferior Sem Pivô Etios 2012 A 2018;;  ;;;;
77261-2;AUTOMOTIVO;Cabo de Freio;KIT;MundiFlex;Par Cabo De Freio Traseira Celta 2001 Em Diante Com Conector;; R$ 45,40 ;;;;
77350/2316/24579046;AUTOMOTIVO;Cabo Câmbio;KIT;Importação;Kit Cabo De Marcha Terminal Reparo Alavanca Celta 2006 A 14;; R$ -   ;;;;
77350P;AUTOMOTIVO;Cabo Câmbio;KIT;Importação;Cabo De Trambulador Prisma 2007 A 2014 Com Pino De Regulagem;; R$ 83,00 ;;;;
77350pt;AUTOMOTIVO;Cabo Câmbio;KIT;Importação / LT CORREA;Cabo Marcha Prisma C/pino De Regulagem Terminal Do Cabo;; R$ -   ;;;;
77350T;AUTOMOTIVO;Cabo Câmbio;KIT;Importação;Cabo De Marcha Prisma 2007/2014 Com Terminal;; R$ 72,93 ;;;;
77351/2345;AUTOMOTIVO;Pastilha Freio;KIT;Importação / LT CORREA;Cabo Engate Seleção Terminal Pino Regulagem Vectra 2006 A 11;; R$ -   ;;;;
77354T;AUTOMOTIVO;Cabo Câmbio;KIT;Importação;Cabo De Engate E Seleção Com Terminal Agile 2009 A 2014;; R$ -   ;;;;
8kit-12152;AUTOMOTIVO;Pino de Porta;KIT;MultiKit;8kits Pino Bucha Dobradiça Porta Belina 1996;; R$ 47,20 ;;;;
993014/15;AUTOMOTIVO;Bandeja;KIT;SPARE;Par Bandeja Inferior Dianteira Transit 2008 Á 2015;; R$ -   ;;;;
993016/17;AUTOMOTIVO;Bandeja;KIT;SPARE;Par Bandeja Inferior Lifan Foison;; R$ -   ;;;;
BBXRE300;AUTOMOTIVO;;SIMPLES;;;;;;;;
BUZ0001;AUTOMOTIVO;Buzina Moto;SIMPLES;POLO;BUZINA DE MOTO CG 125 150 160 NZR 125 160 POP 110i XLW 125 XRE YAHAMA FACTOR 125  ;;;;;;
CCA0002;MOTO PEÇAS;Cabo Acelerador Moto;SIMPLES;POLO;CCA0002 CABO ACELERADOR HONDA CG 125 TITAN ES-JOB-KS-EX DE .../ ATE 2008 CG 150 TITAN EX de ... até 2008;;;;;;
CCA0006;MOTO PEÇAS;Cabo Acelerador Moto;SIMPLES;POLO;CCA0006 CABO ACELERADOR YAMAHA YBR 125 2002/... YBR ED 2006/2008;;;;;;
CCA0009;MOTO PEÇAS;Cabo Acelerador Moto;SIMPLES;POLO;CCA0009 CABO ACELERADOR HONDA CG 150 FAN-TITAN 14/...;;;;;;
CCA0031;MOTO PEÇAS;Cabo Acelerador Moto;SIMPLES;POLO;CCA0031 CABO ACELERADOR HONDA CG 150 TITAN 08>  ;;;;;;
CCA0032;MOTO PEÇAS;Cabo Acelerador Moto;SIMPLES;POLO;CABO ACELERADOR PARA MOTO CBX 250 TWISTER;;;;;;
CCA0035;MOTO PEÇAS;Cabo Acelerador Moto;SIMPLES;POLO;CCA0035 CABO ACELERADOR HONDA CG 150 TITAN MIX ESD 2009/...;;;;;;
CCA0036;MOTO PEÇAS;Cabo Acelerador Moto;SIMPLES;POLO;CCA0036 CABO ACELERADOR HONDA CG NXR 150 BROS ES KS 09>12  ;;;;;;
CCA0038;MOTO PEÇAS;Cabo Acelerador Moto;SIMPLES;POLO;CABO ACELERADOR PARA MOTO CG 150 FAN ESI 2010;;;;;;
CCA0040;MOTO PEÇAS;Cabo Acelerador Moto;SIMPLES;POLO;CCA0040 CABO ACELERADOR HONDA (A) TITAN FAN 160 16>;;;;;;
CCA0041;MOTO PEÇAS;Cabo Acelerador Moto;SIMPLES;POLO;CCA0041 CABO ACELERADOR HONDA (B) TITAN FAN 160 16>;;;;;;
CCE0010;MOTO PEÇAS;Cabo Embreagem moto;SIMPLES;POLO;CABO DA EMBREAGEM PARA MOTO YAHAMA YBR 125 E ED K;;;;;;
CCE0011;MOTO PEÇAS;Cabo Embreagem moto;SIMPLES;POLO;CABO DA EMBREAGEM PARA MOTO YAHAMA YBR 125 FACTOR;;;;;;
CCE0012;MOTO PEÇAS;Cabo Embreagem moto;SIMPLES;POLO;CABO DA EMBREAGEM PARA MOTO HONDA CG 125 TITAN KS KSE;;;;;;
CCE0014;MOTO PEÇAS;Cabo Embreagem moto;SIMPLES;POLO;Cabo De Embreagem Cg 125 Fan Es 2009 A 2010;;;;;;
CCE0015;MOTO PEÇAS;Cabo Embreagem moto;SIMPLES;POLO;CABO DA EMBREAGEM PARA MOTO HONDA CG 125 TITAN KS KSE;;;;;;
CCE0043;MOTO PEÇAS;Cabo Embreagem moto;SIMPLES;POLO;CCE0043 CABO EMBREAGEM HONDA CG 125 TITAN ES 02> E 02/08  ;; R$ -   ;;;;
CCE0044;MOTO PEÇAS;Cabo Embreagem moto;SIMPLES;POLO;CABO DA EMBREAGEM PARA MOTO CG125 TITAN KS;;;;;;
CCE0045;MOTO PEÇAS;Cabo Embreagem moto;SIMPLES;POLO;CCE0045 CABO EMBREAGEM HONDA CG 150 TITAN ES/KS 08>  ;;;;;;
CCE0047;MOTO PEÇAS;Cabo Embreagem moto;SIMPLES;POLO;CCE0047 CABO EMBREAGEM HONDA NXR 150 BROS ESD 08>  ;;;;;;
CCE0048;MOTO PEÇAS;Cabo Embreagem moto;SIMPLES;POLO;CCE0048 CABO EMBREAGEM HONDA HONDA CG 125 FAN ES/KS 09/108,63;;;;;;
CCE0051;MOTO PEÇAS;Cabo Embreagem moto;SIMPLES;POLO;CCE0051 CABO EMBREAGEM HONDA BROS 160 16>  ;;;;;;
CCE0052;MOTO PEÇAS;Cabo Embreagem moto;SIMPLES;POLO;CABO DA EMBREAGEM PARA MOTO HONDA CBX250 TWISTER;;;;;;
CCE0053;MOTO PEÇAS;Cabo Embreagem moto;SIMPLES;POLO;CCE0053 CABO EMBREAGEM HONDA POP 110 16>  ;;;;;;
CCE0054;MOTO PEÇAS;Cabo Embreagem moto;SIMPLES;POLO;CCE0054 CABO EMBREAGEM YAMAHA YBR 125 FACTOR ED/EK 09>  ;;;;;;
CCE0056;MOTO PEÇAS;Cabo Embreagem moto;SIMPLES;POLO;CCE0056 CABO EMBREAGEM HONDA CG 150 TITAN ES/KS 09>  ;;;;;;
CCF0021;MOTO PEÇAS;Cabo Freio Moto;SIMPLES;POLO;CABO DE FREIO PARA MOTO HONDA CG 125 FAN CES CKS ES KS 2009 A 2011;;;;;;
CCF0022;MOTO PEÇAS;Cabo Freio Moto;SIMPLES;POLO;CABO DE FREIO PARA MOTO HONDA CG 125 TITAN ES JOB KS 2004 A 2008;;;;;;
CCF0056;MOTO PEÇAS;Cabo Freio Moto;SIMPLES;POLO;CABO DE FREIO PARA MOTO HONDA CG150 TITAN;;;;;;
CCF0057;MOTO PEÇAS;Cabo Freio Moto;SIMPLES;POLO;CABO DE FREIO PARA MOTO HONDA CG 125 FAN;;;;;;
CCV0027;MOTO PEÇAS;Cabo Velocimetro Moto;SIMPLES;POLO;CCV0027 CABO VELOCIMETRO HONDA CG 150 TITAN KS/ES/JOB 08>;;;;;;
CCV0029;MOTO PEÇAS;Cabo Velocimetro Moto;SIMPLES;POLO;CCV0029 CABO VELOCIMETRO YAMAHA YBR 2002/...;;;;;;
CCV0062;MOTO PEÇAS;Cabo velocímetro Moto;SIMPLES;POLO;Cabo De Velocímetro Nxr 150 Bros Ks 2009 A 2012;; R$ -   ;;;;
CCV0063;MOTO PEÇAS;Cabo Velocimetro Moto;SIMPLES;POLO;CABO DE VELOCÍMETRO PARA MOTO HONDA CG 150 TITAN EDS ES ESD KS;;;;;;
CL001;AUTOMOTIVO;OUTROS;SIMPLES;OUTROS;;;;;;;
CX300;AUTOMOTIVO;coxim motor;SIMPLES;;Coxim Barquinho Do Motor Fusca 1300 1967 Em Diante;;;;;;
FD001;AUTOMOTIVO;Rolamento Roda;SIMPLES;Importação;Kit Rolamento Roda Traseira Ford Verona 1993 1994 1995 1996.;; R$ 30,00 ;;;;
FP270;AUTOMOTIVO;Pastilha Freio;SIMPLES;WILL TEC;Pastilha De Freio De Cerâmica Cruze 2017 Em Diante;; R$ -   ;;;;
fp963;AUTOMOTIVO;Pastilha Freio;SIMPLES;WILL TEC;Pastilha De Freio Diant Cerâmica Trailblazer 2013 Em Diante;; R$ 122,00 ;;;;
fp991;AUTOMOTIVO;Pastilha Freio;SIMPLES;WILL TEC;Pastilha Freio Diant Cerâmica Amarok 3.0 Tdi 2018 Em Diante;; R$ -   ;;;;
fpi023;AUTOMOTIVO;Pastilha Freio;SIMPLES;WILL TEC;Pastilha De Freio Diant Cerâmica Citroen Jumpy Expert 2018;; R$ -   ;;;;
FTK00122;AUTOMOTIVO;Pivô;SIMPLES;SPARE;PIVÔ INFERIOR BANDEJA AMBOS LADOS BRAVO 2011 A 2015;; R$ -   ;;;;
FTK00131;AUTOMOTIVO;Pivô;SIMPLES;SPARE;PIVÔ INFERIOR ESQUERDO ARGO DRIVE 1.0 1.3 GSR 2018 A 2021;; R$ -   ;;;;
FTK00132;AUTOMOTIVO;Pivô;SIMPLES;SPARE;PIVÔ INFERIOR DIREITA ARGO DRIVE 1.0 1.3 GSR 2018 A 2021;; R$ -   ;;;;
ftk00205;AUTOMOTIVO;Pivô;SIMPLES;SPARE;Pivô Ambos Os Lados Bandeja Grand Santa Fé 2014 A 2019 3.3;; R$ 12,50 ;;;;
FTK00206;AUTOMOTIVO;Pivô;SIMPLES;SPARE;PIVÔ SUPERIOR AMBOS LADOS FUSION 2006 A 2012;; R$ -   ;;;;
FTK00208;AUTOMOTIVO;Pivô;SIMPLES;SPARE;PIVÔ INFERIOR DIREITO CR-V 2008 A 2011;; R$ -   ;;;;
FTK00212;AUTOMOTIVO;Pivô;SIMPLES;SPARE;PIVÔ INFERIOR AMBOS LADOS RANGER 2013 A 2017;; R$ -   ;;;;
FTK00213;AUTOMOTIVO;Pivô;SIMPLES;SPARE;PIVÔ SUPERIOR AMBOS LADOS RANGER 2013 A 2016;; R$ -   ;;;;
FTK00223;AUTOMOTIVO;Pivô;SIMPLES;SPARE;PIVÔ INFERIOR AMBOS LADOS S10 2.4 2012 A 2016;; R$ -   ;;;;
FTK00226;AUTOMOTIVO;Pivô;SIMPLES;SPARE;PIVÔ INFERIOR DIREITO FOCUS 2014 EM DIANTE;; R$ -   ;;;;
FTK00227;AUTOMOTIVO;Pivô;SIMPLES;SPARE;PIVÔ INFERIOR ESQUERDO FOCUS 2014 EM DIANTE;; R$ -   ;;;;
FTK00311;AUTOMOTIVO;Pivô;SIMPLES;SPARE;Pivô Bandeja Spin 2013 Em Diante;;  ;;;;
FTK00311/5233;AUTOMOTIVO;Pivô e Bieleta;KIT;SPARE / HOLYMAN;Par Pivô Suspensão E Bieletas Onix 2012 Em Diante;; R$ 29,24 ;;;;
FTK00311-5233;AUTOMOTIVO;Pivô;SIMPLES;SPARE;Par Pivô Suspensão E Bieletas Prisma 2013 Em Diante;; R$ -   ;;;;
FTK00313;AUTOMOTIVO;Bucha Barra estabilizadora;SIMPLES;GUARU BORRACHAS;BUCHA DA SUSPENSÃO DIANTEIRA ESCORT 1993 A JANEIRO 1995;; R$ -   ;;;;
FTK00321;AUTOMOTIVO;Bucha Barra estabilizadora;SIMPLES;GUARU BORRACHAS;BUCHA DA SUSPENSÃO DIANTEIRA ASTRA 1999 EM DIANTE;; R$ -   ;;;;
FTK00353;AUTOMOTIVO;Bucha Barra estabilizadora;SIMPLES;GUARU BORRACHAS;BUCHA DA SUSPENSÃO DIANTEIRA STILO 2012 A 2016;; R$ -   ;;;;
FTK00404;AUTOMOTIVO;;SIMPLES;GUARU BORRACHAS;BUCHA DA SUSPENSÃO DIANTEIRA COBALT 2013 EM DIANTE;; R$ -   ;;;;
FTK00605;AUTOMOTIVO;Pivô;SIMPLES;SPARE;Pivô Inferior Dianteira Ambos Lados Ecosport 2003 A 2013;; R$ -   ;;;;
FTK-00605;AUTOMOTIVO;Pivô;SIMPLES;SPARE;Pivô Da Bandeja Dianteira Ambos Lados Oroch 2016 A 2019;; R$ -   ;;;;
FTK00606;AUTOMOTIVO;Pivô;SIMPLES;SPARE;Pivô Bandeja Dianteira Ambos Os Lados Fluence 2011 Em Diante;; R$ -   ;;;;
FTK00648;AUTOMOTIVO;Pivô;SIMPLES;SPARE;pivô INFERIOR LD/LE MONDEO 1994 á 2001;;;;;;
FTK00903;AUTOMOTIVO;Pivô;SIMPLES;SPARE;Pivô Da Bandeja Inferior Peugeot 208 2013 A 2022;; R$ -   ;;;;
FTK050N;AUTOMOTIVO;Rolamento roda;SIMPLES;IRB;ROLAMENTO RODA DIANTEIRA CHEVETTE 1.6 1973 A 1993;; R$ -   ;;;;
FTK10212;AUTOMOTIVO;Rolamento Roda;SIMPLES;IRB;ROLAMENTO RODA DIANTEIRA AUDI S3 2001 A 2003;; R$ -   ;;;;
FTK11001-MB;AUTOMOTIVO;Bucha Bandeja;SIMPLES;MOBENSANI;Bucha Traseira Da Bandeja Dianteira L200 4x4 1995 A 2006;; R$ -   ;;;;
FTK11003;AUTOMOTIVO;Pivô;SIMPLES;SPARE;Pivô Da Bandeja Inferior Ambos Os Lados Gol 1992 À 1997;; R$ -   ;;;;
FTK11004;AUTOMOTIVO;Pivô;SIMPLES;SPARE;Pivô Inferior Bandeja Dianteira Direito Parati 1983 À 1992;; R$ -   ;;;;
FTK11004-AMW;AUTOMOTIVO;Bucha Bandeja;SIMPLES;AMW;Bucha Dianteira Da Bandeja Dianteira Nivus 2020 Em Diante;; R$ -   ;;;;
FTK11005;AUTOMOTIVO;Pivô;SIMPLES;SPARE;Pivô Inferior Bandeja Dianteira Esquerdo Voyage 1981 À 1992;; R$ -   ;;;;
FTK11006-AMW;AUTOMOTIVO;Bucha Bandeja;SIMPLES;AMW;Bucha Traseira Da Bandeja Dianteira Golf 1999 A 2007;; R$ -   ;;;;
FTK110165;AUTOMOTIVO;Rolamento semi Eixo;SIMPLES;Roletan;Rolamento Coifa Palio G1 1.0 1996 A 2000;;  ;;;;
FTK11018-MB;AUTOMOTIVO;Bucha Bandeja;SIMPLES;MOBENSANI;Bucha Dianteira Da Bandeja Dianteira Pajero Sport 03 Diante;; R$ -   ;;;;
FTK11019;AUTOMOTIVO;Pivô;SIMPLES;SPARE;Pivô Bandeja Inferior Dianteira Ambos Os Lados Van 98 À 02;; R$ 12,50 ;;;;
FTK11019-MB;AUTOMOTIVO;Bucha Bandeja;SIMPLES;MOBENSANI;Bucha Da Bandeja Dianteira Pajero Sport 2001 Em Diante;; R$ -   ;;;;
FTK-11020;AUTOMOTIVO;Pivô;SIMPLES;SPARE;PIVÔ INFERIOR CORCEL DEL REY PAMPA SCALA BELINA;;;;;;
FTK-11020S;AUTOMOTIVO;Pivô;SIMPLES;SPARE;Pivô Superior Del Rey 1982 Á 1991;; R$ -   ;;;;
FTK11021;AUTOMOTIVO;pivô;SIMPLES;SPARE;Pivô Inferior Bandeja Dianteira Ka 1997 À 2007;; R$ 12,50 ;;;;
FTK11022;AUTOMOTIVO;Pivô;SIMPLES;SPARE;Pivô Bandeja Inferior Ambos Lados Verona 1993 A 1996;; R$ -   ;;;;
FTK11023;AUTOMOTIVO;Pivô;SIMPLES;SPARE;PIVÔ INFERIOR CHEVETTE CHEVY MARAJÓ;; R$ -   ;;;;
FTK11024;AUTOMOTIVO;Pivô;SIMPLES;SPARE;Pivô Inferior CORSA 94/97;; R$ -   ;;;;
FTK11026;AUTOMOTIVO;;SIMPLES;;;; R$ -   ;;;;
ftk11028-mb;AUTOMOTIVO;Bucha Bandeja;SIMPLES;MOBENSANI;Bucha Da Bandeja Inferior Dianteira Pajero Tr4 2002 Diante;; R$ -   ;;;;
FTK11030;AUTOMOTIVO;Pivô;SIMPLES;SPARE;Pivô Da Bandeja Inferior Ambos Os Lados Kadett 1989 À 1998;; R$ -   ;;;;
FTK11032;AUTOMOTIVO;Pivô;SIMPLES;SPARE;Pivô Inferior Ambos Lados Grand Siena 2012 A 2021;; R$ -   ;;;;
FTK11038;AUTOMOTIVO;Pivô;SIMPLES;SPARE;PIVÔ INFERIOR AMBOS LADOS PALIO 1996 A 1999;; R$ -   ;;;;
FTK11042;AUTOMOTIVO;Pivô;SIMPLES;SPARE;Pivô Bandeja Dianteira Direita Polo Gti 2006 A 2017;;  ;;;;
FTK11043;AUTOMOTIVO;Pivô;SIMPLES;SPARE;Pivô Bandeja Dianteira Esquerda Polo 2002 A 2017;;  ;;;;
FTK11045;AUTOMOTIVO;Pivô;SIMPLES;SPARE;Pivô Inferior Bandeja Lifan 620 2010 Á 2017 1.6 16v;; R$ -   ;;;;
FTK11047;AUTOMOTIVO;Pivô;SIMPLES;SPARE;Pivô Da Bandeja Dianteira Ambos Lados Montana 2004 A 2010;; R$ -   ;;;;
FTK11048;AUTOMOTIVO;Pivô;SIMPLES;SPARE;pivô Da Bandeja Inferior C3 2002 À 2013;; R$ -   ;;;;
FTK11049;AUTOMOTIVO;Pivô;SIMPLES;SPARE;Pivô Bandeja Inferior Dianteira Esquerda Doblô 2003 À 2017;;  ;;;;
FTK-11049;AUTOMOTIVO;Pivô;SIMPLES;SPARE;Pivô Bandeja Inferior Dianteira Esquerda Doblô 2003 À 2017;; R$ -   ;;;;
FTK11050;AUTOMOTIVO;Pivô;SIMPLES;SPARE;Pivô Bandeja Inferior Dianteira Direita Doblô 2003 À 2017;;  ;;;;
FTK-11050;AUTOMOTIVO;Pivô;SIMPLES;SPARE;Pivô Bandeja Inferior Dianteira Direita Doblô 2003 À 2017;; R$ -   ;;;;
FTK11051;AUTOMOTIVO;Pivô;SIMPLES;SPARE;PIVÔ INFERIOR AMBOS LADOS MERIVA 1.4 1.8 2003 A 2012;; R$ -   ;;;;
FTK11052;AUTOMOTIVO;Pivô;SIMPLES;SPARE;Pivô Inferior Direita Strada Adventure Locker 2009 A 2017;;  ;;;;
FTK11053;AUTOMOTIVO;Pivô;SIMPLES;SPARE;Pivô Inferior Da Bandeja Esquerda Idea Adventure 2006 A 2017;;  ;;;;
FTK11055;AUTOMOTIVO;Pivô;SIMPLES;SPARE;Pivô Bandeja Dianteira Ambos Os Lados Punto 2008 A 2017;;  ;;;;
FTK11056;AUTOMOTIVO;Pivô;SIMPLES;SPARE;Pivô Lado Direito Crossfox 2014 Em Diante;; R$ 12,50 ;;;;
FTK11057;AUTOMOTIVO;Pivô;SIMPLES;SPARE;Pivô Lado Esquerdo Gol G6 2012 Em Diante;; R$ 12,50 ;;;;
FTK11058;AUTOMOTIVO;Pivô;SIMPLES;SPARE;Pivô Inferior Bandeja Dianteira Idea Ambos Lados 2006 À 2017;; R$ -   ;;;;
FTK11060;AUTOMOTIVO;Pivô;SIMPLES;SPARE;Pivô Da Bandeja Inferior Ambos Lados Aircross 2011 A 2021;; R$ 24,00 ;;;;
FTK11110;AUTOMOTIVO;Pivô;SIMPLES;SPARE;Pivô Inferior Ambos Lados I30 I Fd 2007 A 2012;; R$ -   ;;;;
FTK11140-MB;AUTOMOTIVO;Bucha Bandeja;SIMPLES;MOBENSANI;Bucha Da Bandeja Superior Suspensão Dianteira Blazer 96 A 11;; R$ -   ;;;;
FTK11170-MB;AUTOMOTIVO;Bucha Bandeja;SIMPLES;MOBENSANI;BUCHA TRASEIRA DA BANDEJA DIANTEIRA OMEGA SUPREMA 93 A 98;; R$ -   ;;;;
FTK11171-MB;AUTOMOTIVO;Bucha Bandeja;SIMPLES;MOBENSANI;BUCHA DIANTEIRA DA BANDEJA DIANTEIRA OMEGA SUPREMA 93 A 98;; R$ -   ;;;;
FTK11203A-MB;AUTOMOTIVO;Bucha Bandeja;SIMPLES;MOBENSANI;Refil Bucha Dianteira Da Bandeja Dianteira Meriva 2002 A 12;; R$ -   ;;;;
